id_leggo,id_autor,nome,partido,uf,bancada,nome_eleitoral,node_size
42,178868,Dep. Odorico Monteiro,PSB,CE,oposição,Dep. Odorico Monteiro (PSB/CE),0.8333333333333333
42,178986,Dep. Nilto Tatto,PT,SP,oposição,Dep. Nilto Tatto (PT/SP),8.666666666666666
43,177282,Dep. Subtenente Gonzaga,PDT,MG,oposição,Dep. Subtenente Gonzaga (PDT/MG),2
44,109429,Dep. Benes Leocádio,PRB,RN,governo,Dep. Benes Leocádio (PRB/RN),1
44,116379,Dep. Darci De Matos,PSD,SC,governo,Dep. Darci De Matos (PSD/SC),3
44,122158,Dep. Pedro Paulo,DEM,RJ,governo,Dep. Pedro Paulo (DEM/RJ),1
44,122974,Dep. Pedro Lucas Fernandes,PTB,MA,governo,Dep. Pedro Lucas Fernandes (PTB/MA),2
44,132504,Dep. Enio Verri,PT,,oposição,Dep. Enio Verri (PT/NA),4
44,133439,Dep. André Figueiredo,PDT,CE,oposição,Dep. André Figueiredo (PDT/CE),4
44,141391,Dep. Arnaldo Jardim,CIDADANIA,SP,governo,Dep. Arnaldo Jardim (CIDADANIA/SP),4
44,141417,Dep. Edio Lopes,PL,RR,governo,Dep. Edio Lopes (PL/RR),1
44,141422,Dep. Efraim Filho,DEM,,governo,Dep. Efraim Filho (DEM/NA),5
44,141427,Dep. Fábio Ramalho,MDB,MG,governo,Dep. Fábio Ramalho (MDB/MG),1
44,141458,Dep. João Carlos Bacelar,PL,BA,governo,Dep. João Carlos Bacelar (PL/BA),1
44,141488,Dep. Paulo Teixeira,PT,SP,oposição,Dep. Paulo Teixeira (PT/SP),4.857142857142858
44,141508,Dep. Mauro Nazif,PSB,RO,oposição,Dep. Mauro Nazif (PSB/RO),1
44,141513,Dep. Bilac Pinto,DEM,MG,governo,Dep. Bilac Pinto (DEM/MG),0.8571428571428571
44,141516,Dep. Paulo Abi-Ackel,PSDB,MG,governo,Dep. Paulo Abi-Ackel (PSDB/MG),1
44,141523,Dep. Raul Henry,MDB,PE,governo,Dep. Raul Henry (MDB/PE),2
44,141531,Dep. Rodrigo De Castro,PSDB,MG,governo,Dep. Rodrigo De Castro (PSDB/MG),1
44,141553,Dep. Vanderlei Macris,PSDB,SP,governo,Dep. Vanderlei Macris (PSDB/SP),3
44,151208,Dep. Laercio Oliveira,PP,SE,governo,Dep. Laercio Oliveira (PP/SE),10
44,156190,Dep. Marcel Van Hattem,NOVO,RS,governo,Dep. Marcel Van Hattem (NOVO/RS),1
44,159237,Dep. Assis Carvalho,PT,PI,oposição,Dep. Assis Carvalho (PT/PI),1
44,160508,Dep. Afonso Florence,PT,BA,oposição,Dep. Afonso Florence (PT/BA),4
44,160518,Dep. Weliton Prado,PROS,MG,governo,Dep. Weliton Prado (PROS/MG),2
44,160527,Dep. Aguinaldo Ribeiro,PP,PB,governo,Dep. Aguinaldo Ribeiro (PP/PB),3
44,160538,Dep. Bohn Gass,PT,RS,oposição,Dep. Bohn Gass (PT/RS),1
44,160569,Dep. Waldenor Pereira,PT,BA,oposição,Dep. Waldenor Pereira (PT/BA),1
44,160570,Dep. Jerônimo Goergen,PP,RS,governo,Dep. Jerônimo Goergen (PP/RS),3
44,160600,Dep. Arthur Oliveira Maia,DEM,BA,governo,Dep. Arthur Oliveira Maia (DEM/BA),1
44,160639,Dep. Professora Dorinha Seabra Rezende,DEM,TO,governo,Dep. Professora Dorinha Seabra Rezende (DEM/TO),4
44,160666,Dep. Félix Mendonça Júnior,PDT,BA,oposição,Dep. Félix Mendonça Júnior (PDT/BA),2
44,160758,Dep. Domingos Sávio,PSDB,MG,governo,Dep. Domingos Sávio (PSDB/MG),1
44,162332,Dep. Luiz Nishimori,PL,PR,governo,Dep. Luiz Nishimori (PL/PR),1
44,177282,Dep. Subtenente Gonzaga,PDT,MG,oposição,Dep. Subtenente Gonzaga (PDT/MG),5.273809523809524
44,178832,Dep. Leandre,PV,PR,governo,Dep. Leandre (PV/PR),1
44,178835,Dep. Afonso Motta,PDT,RS,oposição,Dep. Afonso Motta (PDT/RS),1
44,178863,Dep. Uldurico Junior,PROS,BA,governo,Dep. Uldurico Junior (PROS/BA),1
44,178871,Dep. Evair Vieira De Melo,PP,ES,governo,Dep. Evair Vieira De Melo (PP/ES),2
44,178879,Dep. Lucas Vergilio,SOLIDARIEDADE,GO,governo,Dep. Lucas Vergilio (SOLIDARIEDADE/GO),1
44,178884,Dep. Hildo Rocha,MDB,MA,governo,Dep. Hildo Rocha (MDB/MA),2
44,178886,Dep. Juscelino Filho,DEM,MA,governo,Dep. Juscelino Filho (DEM/MA),1
44,178896,Dep. Newton Cardoso Jr,MDB,MG,governo,Dep. Newton Cardoso Jr (MDB/MG),8
44,178930,Dep. Evandro Roman,PSD,PR,governo,Dep. Evandro Roman (PSD/PR),4
44,178933,Dep. Sergio Souza,MDB,PR,governo,Dep. Sergio Souza (MDB/PR),4
44,178934,Dep. Toninho Wandscheer,PROS,PR,governo,Dep. Toninho Wandscheer (PROS/PR),1
44,178937,Dep. Altineu Côrtes,PL,RJ,governo,Dep. Altineu Côrtes (PL/RJ),1
44,178939,Dep. Clarissa Garotinho,PROS,RJ,governo,Dep. Clarissa Garotinho (PROS/RJ),0.8571428571428571
44,178956,Dep. Mariana Carvalho,PSDB,RO,governo,Dep. Mariana Carvalho (PSDB/RO),1
44,178959,Dep. Hiran Gonçalves,PP,RR,governo,Dep. Hiran Gonçalves (PP/RR),1
44,178962,Dep. Carlos Gomes,PRB,RS,governo,Dep. Carlos Gomes (PRB/RS),1
44,178975,Dep. Baleia Rossi,MDB,SP,governo,Dep. Baleia Rossi (MDB/SP),1
44,178977,Dep. Eduardo Cury,PSDB,SP,governo,Dep. Eduardo Cury (PSDB/SP),4
44,178981,Dep. Herculano Passos,MDB,SP,governo,Dep. Herculano Passos (MDB/SP),3
44,178983,Dep. Marcio Alvino,PL,SP,governo,Dep. Marcio Alvino (PL/SP),1
44,178989,Dep. Renata Abreu,PODE,SP,governo,Dep. Renata Abreu (PODE/SP),2
44,178992,Dep. Vitor Lippi,PSDB,SP,governo,Dep. Vitor Lippi (PSDB/SP),6
44,178993,Dep. Carlos Henrique Gaguim,DEM,TO,governo,Dep. Carlos Henrique Gaguim (DEM/TO),1
44,178994,Dep. Dulce Miranda,MDB,TO,governo,Dep. Dulce Miranda (MDB/TO),1
44,178997,Dep. Moses Rodrigues,MDB,CE,governo,Dep. Moses Rodrigues (MDB/CE),4
44,191923,Dep. Flavio Nogueira,PDT,PI,oposição,Dep. Flavio Nogueira (PDT/PI),1
44,204355,Dep. Da Vitoria,CIDADANIA,ES,governo,Dep. Da Vitoria (CIDADANIA/ES),3
44,204359,Dep. Léo Moraes,PODE,RO,governo,Dep. Léo Moraes (PODE/RO),4
44,204364,Dep. Eli Borges,SOLIDARIEDADE,TO,governo,Dep. Eli Borges (SOLIDARIEDADE/TO),1
44,204371,Dep. Felipe Rigoni,PSB,ES,oposição,Dep. Felipe Rigoni (PSB/ES),5
44,204377,Dep. Paula Belmonte,CIDADANIA,DF,governo,Dep. Paula Belmonte (CIDADANIA/DF),1
44,204380,Dep. Celina Leão,PP,DF,governo,Dep. Celina Leão (PP/DF),1
44,204381,Dep. Luis Miranda,DEM,DF,governo,Dep. Luis Miranda (DEM/DF),3
44,204383,Dep. Professor Israel Batista,PV,DF,governo,Dep. Professor Israel Batista (PV/DF),4
44,204389,Dep. Elias Vaz,PSB,GO,oposição,Dep. Elias Vaz (PSB/GO),1
44,204392,Dep. Francisco Jr.,PSD,GO,governo,Dep. Francisco Jr. (PSD/GO),1
44,204396,Dep. Vermelho,PSD,PR,governo,Dep. Vermelho (PSD/PR),1
44,204400,Dep. Aline Sleutjes,PSL,PR,governo,Dep. Aline Sleutjes (PSL/PR),1
44,204403,Dep. Marlon Santos,PDT,RS,oposição,Dep. Marlon Santos (PDT/RS),1
44,204406,Dep. Pedro Westphalen,PP,RS,governo,Dep. Pedro Westphalen (PP/RS),1
44,204407,Dep. Fernanda Melchionna,PSOL,RS,oposição,Dep. Fernanda Melchionna (PSOL/RS),7.5
44,204413,Dep. Alcides Rodrigues,PATRIOTA,GO,governo,Dep. Alcides Rodrigues (PATRIOTA/GO),3
44,204419,Dep. Glaustin Fokus,PSC,GO,governo,Dep. Glaustin Fokus (PSC/GO),2
44,204425,Dep. Silvio Costa Filho,PRB,PE,governo,Dep. Silvio Costa Filho (PRB/PE),3
44,204427,Dep. Fernando Rodolfo,PL,PE,governo,Dep. Fernando Rodolfo (PL/PE),1
44,204431,Dep. Marcos Aurélio Sampaio,MDB,PI,governo,Dep. Marcos Aurélio Sampaio (MDB/PI),2
44,204433,Dep. Marcelo Calero,CIDADANIA,RJ,governo,Dep. Marcelo Calero (CIDADANIA/RJ),1
44,204440,Dep. Christino Aureo,PP,RJ,governo,Dep. Christino Aureo (PP/RJ),1
44,204460,Dep. Carlos Jordy,PSL,RJ,governo,Dep. Carlos Jordy (PSL/RJ),1
44,204461,Dep. Paulo Ganime,NOVO,RJ,governo,Dep. Paulo Ganime (NOVO/RJ),0.5
44,204464,Dep. Talíria Petrone,PSOL,RJ,oposição,Dep. Talíria Petrone (PSOL/RJ),2.8571428571428568
44,204468,Dep. Joenia Wapichana,REDE,RR,oposição,Dep. Joenia Wapichana (REDE/RR),5
44,204482,Dep. Euclydes Pettersen,PSC,MG,governo,Dep. Euclydes Pettersen (PSC/MG),2
44,204484,Dep. General Peternelli,PSL,SP,governo,Dep. General Peternelli (PSL/SP),1
44,204485,Dep. Luiz Carlos Motta,PL,SP,governo,Dep. Luiz Carlos Motta (PL/SP),5
44,204487,Dep. Capitão Wagner,PROS,CE,governo,Dep. Capitão Wagner (PROS/CE),0.75
44,204491,Dep. Gilberto Abramo,PRB,MG,governo,Dep. Gilberto Abramo (PRB/MG),1
44,204496,Dep. Celso Sabino,PSDB,PA,governo,Dep. Celso Sabino (PSDB/PA),6
44,204499,Dep. Cássio Andrade,PSB,PA,oposição,Dep. Cássio Andrade (PSB/PA),1
44,204500,Dep. Eduardo Costa,PTB,PA,governo,Dep. Eduardo Costa (PTB/PA),9
44,204501,Dep. Alencar Santana Braga,PT,SP,oposição,Dep. Alencar Santana Braga (PT/SP),2.857142857142857
44,204504,Dep. Cezinha De Madureira,PSD,SP,governo,Dep. Cezinha De Madureira (PSD/SP),2
44,204506,Dep. Marcos Pereira,PRB,SP,governo,Dep. Marcos Pereira (PRB/SP),1
44,204514,Dep. Coronel Tadeu,PSL,SP,governo,Dep. Coronel Tadeu (PSL/SP),2.75
44,204515,Dep. André Janones,AVANTE,MG,governo,Dep. André Janones (AVANTE/MG),2
44,204516,Dep. Alexis Fonteyne,NOVO,SP,governo,Dep. Alexis Fonteyne (NOVO/SP),7.5
44,204517,Dep. Zé Vitor,PL,MG,governo,Dep. Zé Vitor (PL/MG),1
44,204518,Dep. Dr. Frederico,PATRIOTA,MG,governo,Dep. Dr. Frederico (PATRIOTA/MG),4
44,204526,Dep. Luiz Philippe De Orleans e Bragança,PSL,SP,governo,Dep. Luiz Philippe De Orleans e Bragança (PSL/SP),4
44,204527,Dep. Geninho Zuliani,DEM,SP,governo,Dep. Geninho Zuliani (DEM/SP),1
44,204534,Dep. Tabata Amaral,PDT,SP,oposição,Dep. Tabata Amaral (PDT/SP),4
44,204537,Dep. Enrico Misasi,PV,SP,governo,Dep. Enrico Misasi (PV/SP),1
44,204543,Dep. Luiz Flávio Gomes,PSB,SP,oposição,Dep. Luiz Flávio Gomes (PSB/SP),1
44,204551,Dep. Bosco Saraiva,SOLIDARIEDADE,AM,governo,Dep. Bosco Saraiva (SOLIDARIEDADE/AM),1.8
44,204552,Dep. Eduardo Braide,PMN,MA,governo,Dep. Eduardo Braide (PMN/MA),2
44,204555,Dep. José Ricardo,PT,AM,oposição,Dep. José Ricardo (PT/AM),1.8
44,204556,Dep. Marcelo Ramos,PL,AM,governo,Dep. Marcelo Ramos (PL/AM),7.8
44,204557,Dep. Sidney Leite,PSD,AM,governo,Dep. Sidney Leite (PSD/AM),5.800000000000001
44,204559,Dep. Zé Neto,PT,BA,oposição,Dep. Zé Neto (PT/BA),1
44,204566,Dep. Marreca Filho,PATRIOTA,MA,governo,Dep. Marreca Filho (PATRIOTA/MA),1
44,204570,Dep. Pastor Gildenemyr,PMN,MA,governo,Dep. Pastor Gildenemyr (PMN/MA),2
44,204572,Dep. Capitão Alberto Neto,PRB,AM,governo,Dep. Capitão Alberto Neto (PRB/AM),4.55
44,204575,Dep. Gil Cutrim,PDT,MA,oposição,Dep. Gil Cutrim (PDT/MA),2
44,204576,Dep. João Roma,PRB,BA,governo,Dep. João Roma (PRB/BA),3
44,207309,Dep. Enéias Reis,PSL,MG,governo,Dep. Enéias Reis (PSL/MG),1
44,66828,Dep. Fausto Pinato,PP,SP,governo,Dep. Fausto Pinato (PP/SP),4
44,73486,Dep. Pompeo De Mattos,PDT,RS,oposição,Dep. Pompeo De Mattos (PDT/RS),0.6666666666666666
44,74043,Dep. Wellington Roberto,PL,PB,governo,Dep. Wellington Roberto (PL/PB),2
44,74044,Dep. Wilson Santiago,PTB,PB,governo,Dep. Wilson Santiago (PTB/PB),2
44,74052,Dep. Bosco Costa,PL,SE,governo,Dep. Bosco Costa (PL/SE),1
44,74060,Dep. Daniel Almeida,PCdoB,BA,oposição,Dep. Daniel Almeida (PCdoB/BA),4
44,74161,Dep. Reginaldo Lopes,PT,MG,oposição,Dep. Reginaldo Lopes (PT/MG),6
44,74305,Dep. Roberto Pessoa,PSDB,CE,governo,Dep. Roberto Pessoa (PSDB/CE),3
44,74317,Dep. Júlio Cesar,PSD,PI,governo,Dep. Júlio Cesar (PSD/PI),7
44,74356,Dep. Silas Câmara,PRB,AM,governo,Dep. Silas Câmara (PRB/AM),1
44,74366,Dep. João Campos,PRB,GO,governo,Dep. João Campos (PRB/GO),2
44,74478,Dep. Luciano Bivar,PSL,PE,governo,Dep. Luciano Bivar (PSL/PE),1
44,74749,Dep. Mauro Lopes,MDB,MG,governo,Dep. Mauro Lopes (MDB/MG),1
44,74848,Dep. Jandira Feghali,PCdoB,RJ,oposição,Dep. Jandira Feghali (PCdoB/RJ),1
44,76874,Dep. Marcelo Freixo,PSOL,RJ,oposição,Dep. Marcelo Freixo (PSOL/RJ),7.5
44,90201,Dep. Pedro Augusto Bezerra,PTB,CE,governo,Dep. Pedro Augusto Bezerra (PTB/CE),2
44,90842,Dep. Santini,PTB,RS,governo,Dep. Santini (PTB/RS),4
44,98057,Dep. Lafayette De Andrada,PRB,MG,governo,Dep. Lafayette De Andrada (PRB/MG),0.8571428571428571
44,204541,Dep. Eduardo Bismarck,PDT,CE,oposição,Dep. Eduardo Bismarck (PDT/CE),0.6666666666666666
45,133439,Dep. André Figueiredo,PDT,CE,oposição,Dep. André Figueiredo (PDT/CE),2
45,143632,Dep. Domingos Neto,PSD,CE,governo,Dep. Domingos Neto (PSD/CE),0.75
45,160531,Dep. Jhonatan De Jesus,PRB,RR,governo,Dep. Jhonatan De Jesus (PRB/RR),1
45,160541,Dep. Arthur Lira,PP,AL,governo,Dep. Arthur Lira (PP/AL),0.75
45,178854,Dep. Elmar Nascimento,DEM,BA,governo,Dep. Elmar Nascimento (DEM/BA),1
45,178879,Dep. Lucas Vergilio,SOLIDARIEDADE,GO,governo,Dep. Lucas Vergilio (SOLIDARIEDADE/GO),0.75
45,178989,Dep. Renata Abreu,PODE,SP,governo,Dep. Renata Abreu (PODE/SP),1
45,204358,Dep. Beto Pereira,PSDB,MS,governo,Dep. Beto Pereira (PSDB/MS),1
45,204391,Dep. José Nelto,PODE,GO,governo,Dep. José Nelto (PODE/GO),1
45,73486,Dep. Pompeo De Mattos,PDT,RS,oposição,Dep. Pompeo De Mattos (PDT/RS),1
45,74043,Dep. Wellington Roberto,PL,PB,governo,Dep. Wellington Roberto (PL/PB),1
45,74044,Dep. Wilson Santiago,PTB,PB,governo,Dep. Wilson Santiago (PTB/PB),13
45,74471,Dep. André De Paula,PSD,PE,governo,Dep. André De Paula (PSD/PE),1
45,1173,Sen. Wellington Fagundes,PR,MT,governo,Sen. Wellington Fagundes (PR/MT),3
45,5411,Sen. Weverton,PDT,MA,oposição,Sen. Weverton (PDT/MA),4
45,5527,Sen. Simone Tebet,PMDB,MS,governo,Sen. Simone Tebet (PMDB/MS),4
45,5533,Sen. Lasier Martins,PSD,RS,governo,Sen. Lasier Martins (PSD/RS),3
45,5535,Sen. Telmário Mota,PROS,RR,governo,Sen. Telmário Mota (PROS/RR),4
45,5924,Sen. Oriovisto Guimarães,PODEMOS,PR,governo,Sen. Oriovisto Guimarães (PODEMOS/PR),1
45,5929,Sen. Juíza Selma,PSL,MT,governo,Sen. Juíza Selma (PSL/MT),2
45,5953,Sen. Fabiano Contarato,REDE,ES,oposição,Sen. Fabiano Contarato (REDE/ES),5
45,5982,Sen. Alessandro Vieira,CIDADANIA,SE,governo,Sen. Alessandro Vieira (CIDADANIA/SE),21
45,677,Sen. Roberto Rocha,PSDB,MA,governo,Sen. Roberto Rocha (PSDB/MA),1
45,178975,Dep. Baleia Rossi,MDB,SP,governo,Dep. Baleia Rossi (MDB/SP),0.75
46,141398,Dep. Carlos Zarattini,PT,SP,oposição,Dep. Carlos Zarattini (PT/SP),2
46,141508,Dep. Mauro Nazif,PSB,RO,oposição,Dep. Mauro Nazif (PSB/RO),1
46,178883,Dep. Eliziane Gama,PPS,MA,governo,Dep. Eliziane Gama (PPS/MA),1
46,178916,Dep. Daniel Coelho,CIDADANIA,PE,governo,Dep. Daniel Coelho (CIDADANIA/PE),1
46,178954,Dep. Lucio Mosquini,MDB,RO,governo,Dep. Lucio Mosquini (MDB/RO),2
46,204391,Dep. José Nelto,PODE,GO,governo,Dep. José Nelto (PODE/GO),1
46,204396,Dep. Vermelho,PSD,PR,governo,Dep. Vermelho (PSD/PR),1
46,204449,Dep. Nelson Barbudo,PSL,MT,governo,Dep. Nelson Barbudo (PSL/MT),1
46,204530,Dep. Rodrigo Agostinho,PSB,SP,oposição,Dep. Rodrigo Agostinho (PSB/SP),1
46,73483,Dep. Luis Carlos Heinze,PP,,governo,Dep. Luis Carlos Heinze (PP/NA),13
46,73771,Dep. Flávio Arns,PT,PR,oposição,Dep. Flávio Arns (PT/PR),1
46,73933,Dep. Zequinha Marinho,PSC,,governo,Dep. Zequinha Marinho (PSC/NA),1
46,74131,Dep. João Carlos Bacelar,PR,BA,governo,Dep. João Carlos Bacelar (PR/BA),1.5
46,74400,Dep. Paulo Pimenta,PT,RS,oposição,Dep. Paulo Pimenta (PT/RS),1
46,2331,Sen. Rose de Freitas,PMDB,ES,governo,Sen. Rose de Freitas (PMDB/ES),1
46,285,Sen. Marcio Bittar,MDB,AC,governo,Sen. Marcio Bittar (MDB/AC),3
46,4770,Sen. Izalci Lucas,PSDB,DF,governo,Sen. Izalci Lucas (PSDB/DF),4
46,4994,Sen. Eduardo Braga,MDB,AM,governo,Sen. Eduardo Braga (MDB/AM),1
46,5352,Sen. Rogério Carvalho,PT,SE,oposição,Sen. Rogério Carvalho (PT/SE),3
46,5523,Sen. Otto Alencar,PSD,BA,governo,Sen. Otto Alencar (PSD/BA),5
46,5531,Sen. Elmano Férrer,PODEMOS,PI,governo,Sen. Elmano Férrer (PODEMOS/PI),2
46,5666,Sen. Major Olimpio,PSL,SP,governo,Sen. Major Olimpio (PSL/SP),2
46,5718,Sen. Eliziane Gama,CIDADANIA,MA,governo,Sen. Eliziane Gama (CIDADANIA/MA),3
46,5905,Sen. Rodrigo Cunha,PSDB,AL,governo,Sen. Rodrigo Cunha (PSDB/AL),1
46,5942,Sen. Marcos do Val,PODEMOS,ES,governo,Sen. Marcos do Val (PODEMOS/ES),2
46,5953,Sen. Fabiano Contarato,REDE,ES,oposição,Sen. Fabiano Contarato (REDE/ES),1
46,5982,Sen. Alessandro Vieira,CIDADANIA,SE,governo,Sen. Alessandro Vieira (CIDADANIA/SE),1
46,5988,Sen. Soraya Thronicke,PSL,MS,governo,Sen. Soraya Thronicke (PSL/MS),5
46,751,Sen. Arolde de Oliveira,PSD,RJ,governo,Sen. Arolde de Oliveira (PSD/RJ),7
46,945,Sen. Alvaro Dias,PODEMOS,PR,governo,Sen. Alvaro Dias (PODEMOS/PR),1
46,1186,Sen. Luis Carlos Heinze,PP,RS,governo,Sen. Luis Carlos Heinze (PP/RS),13
46,178933,Sen. Sergio Souza,MDB,PR,governo,Sen. Sergio Souza (MDB/PR),6
46,345,Sen. Flávio Arns,REDE,PR,oposição,Sen. Flávio Arns (REDE/PR),1
46,3806,Sen. Zequinha Marinho,PSC,PA,governo,Sen. Zequinha Marinho (PSC/PA),1
46,5012,Sen. Randolfe Rodrigues,REDE,AP,oposição,Sen. Randolfe Rodrigues (REDE/AP),1
46,5385,Sen. Irajá,PSD,TO,governo,Sen. Irajá (PSD/TO),3
46,5959,Sen. Styvenson Valentim,PODEMOS,RN,governo,Sen. Styvenson Valentim (PODEMOS/RN),1
46,141458,Sen. João Carlos Bacelar,PL,BA,governo,Sen. João Carlos Bacelar (PL/BA),0.5
48,132504,Dep. Enio Verri,PT,,oposição,Dep. Enio Verri (PT/-),1
48,133439,Dep. André Figueiredo,PDT,CE,oposição,Dep. André Figueiredo (PDT/-),1.5
48,133968,Dep. Paulo Ramos,PDT,RJ,oposição,Dep. Paulo Ramos (PDT/-),10.8
48,141411,Dep. Dagoberto Nogueira,PDT,MS,oposição,Dep. Dagoberto Nogueira (PDT/-),0.75
48,141450,Dep. Hugo Leal,PSD,RJ,governo,Dep. Hugo Leal (PSD/-),3.05
48,141518,Dep. Paulo Pereira Da Silva,SOLIDARIEDADE,SP,governo,Dep. Paulo Pereira Da Silva (SOLIDARIEDADE/-),1
48,150418,Dep. Márcio Marinho,PRB,BA,governo,Dep. Márcio Marinho (PRB/-),1
48,156190,Dep. Marcel Van Hattem,NOVO,RS,governo,Dep. Marcel Van Hattem (NOVO/-),0.8333333333333333
48,160511,Dep. Alessandro Molon,PSB,RJ,oposição,Dep. Alessandro Molon (PSB/-),15
48,160541,Dep. Arthur Lira,PP,AL,governo,Dep. Arthur Lira (PP/-),1
48,160545,Dep. Alexandre Leite,DEM,SP,governo,Dep. Alexandre Leite (DEM/-),12.666666666666666
48,160575,Dep. Erika Kokay,PT,DF,oposição,Dep. Erika Kokay (PT/-),21
48,160587,Dep. Fábio Trad,PSD,MS,governo,Dep. Fábio Trad (PSD/-),2.833333333333333
48,160598,Dep. Flávia Morais,PDT,GO,oposição,Dep. Flávia Morais (PDT/-),1
48,160604,Dep. Pedro Uczai,PT,SC,oposição,Dep. Pedro Uczai (PT/-),1.5
48,160642,Dep. Pastor Eurico,PATRIOTA,PE,governo,Dep. Pastor Eurico (PATRIOTA/-),1.6666666666666665
48,160655,Dep. Ricardo Izar,PP,SP,governo,Dep. Ricardo Izar (PP/-),2
48,160673,Dep. Giovani Cherini,PL,RS,governo,Dep. Giovani Cherini (PL/-),0.6666666666666666
48,160674,Dep. Hugo Motta,PRB,PB,governo,Dep. Hugo Motta (PRB/-),3
48,164359,Dep. Delegado Waldir,PSL,GO,governo,Dep. Delegado Waldir (PSL/-),12.175
48,178829,Dep. Capitão Augusto,PL,SP,governo,Dep. Capitão Augusto (PL/-),1.55
48,178881,Dep. Aluisio Mendes,PODE,MA,governo,Dep. Aluisio Mendes (PODE/-),0.75
48,178916,Dep. Daniel Coelho,CIDADANIA,PE,governo,Dep. Daniel Coelho (CIDADANIA/-),1
48,178934,Dep. Toninho Wandscheer,PROS,PR,governo,Dep. Toninho Wandscheer (PROS/-),0.8333333333333333
48,179587,Dep. Major Vitor Hugo,PSL,GO,governo,Dep. Major Vitor Hugo (PSL/-),3.583333333333333
48,198783,Dep. Emanuel Pinheiro Neto,PTB,MT,governo,Dep. Emanuel Pinheiro Neto (PTB/-),3.5416666666666665
48,204359,Dep. Léo Moraes,PODE,RO,governo,Dep. Léo Moraes (PODE/-),1.675
48,204363,Dep. Osires Damaso,PSC,TO,governo,Dep. Osires Damaso (PSC/-),1
48,204369,Dep. Caroline De Toni,PSL,SC,governo,Dep. Caroline De Toni (PSL/-),0.8333333333333333
48,204371,Dep. Felipe Rigoni,PSB,ES,oposição,Dep. Felipe Rigoni (PSB/-),1
48,204373,Dep. Hélio Costa,PRB,SC,governo,Dep. Hélio Costa (PRB/-),1
48,204376,Dep. Coronel Armando,PSL,SC,governo,Dep. Coronel Armando (PSL/-),2
48,204377,Dep. Paula Belmonte,CIDADANIA,DF,governo,Dep. Paula Belmonte (CIDADANIA/-),0.8333333333333333
48,204388,Dep. Bibo Nunes,PSL,RS,governo,Dep. Bibo Nunes (PSL/-),0.8
48,204391,Dep. José Nelto,PODE,GO,governo,Dep. José Nelto (PODE/-),1.7083333333333333
48,204403,Dep. Marlon Santos,PDT,RS,oposição,Dep. Marlon Santos (PDT/-),1
48,204418,Dep. Luizão Goulart,PRB,PR,governo,Dep. Luizão Goulart (PRB/-),1
48,204427,Dep. Fernando Rodolfo,PL,PE,governo,Dep. Fernando Rodolfo (PL/-),2.6666666666666665
48,204454,Dep. Daniel Silveira,PSL,RJ,governo,Dep. Daniel Silveira (PSL/-),1
48,204461,Dep. Paulo Ganime,NOVO,RJ,governo,Dep. Paulo Ganime (NOVO/-),1
48,204466,Dep. Tereza Nelma,PSDB,AL,governo,Dep. Tereza Nelma (PSDB/-),4
48,204479,Dep. Nicoletti,PSL,RR,governo,Dep. Nicoletti (PSL/-),2
48,204484,Dep. General Peternelli,PSL,SP,governo,Dep. General Peternelli (PSL/-),1
48,204487,Dep. Capitão Wagner,PROS,CE,governo,Dep. Capitão Wagner (PROS/-),0.875
48,204514,Dep. Coronel Tadeu,PSL,SP,governo,Dep. Coronel Tadeu (PSL/-),1
48,204526,Dep. Luiz Philippe De Orleans e Bragança,PSL,SP,governo,Dep. Luiz Philippe De Orleans e Bragança (PSL/-),1
48,204559,Dep. Zé Neto,PT,BA,oposição,Dep. Zé Neto (PT/-),4
48,204562,Dep. Edilázio Júnior,PSD,MA,governo,Dep. Edilázio Júnior (PSD/-),1
48,204570,Dep. Pastor Gildenemyr,PMN,MA,governo,Dep. Pastor Gildenemyr (PMN/-),1
48,204572,Dep. Capitão Alberto Neto,PRB,AM,governo,Dep. Capitão Alberto Neto (PRB/-),2.6666666666666665
48,68720,Dep. Fábio Henrique,PDT,SE,oposição,Dep. Fábio Henrique (PDT/-),1.875
48,73486,Dep. Pompeo De Mattos,PDT,RS,oposição,Dep. Pompeo De Mattos (PDT/-),4.133333333333333
48,74043,Dep. Wellington Roberto,PL,PB,governo,Dep. Wellington Roberto (PL/-),0.6666666666666666
48,74366,Dep. João Campos,PRB,GO,governo,Dep. João Campos (PRB/-),6.05
48,74471,Dep. André De Paula,PSD,PE,governo,Dep. André De Paula (PSD/-),0.875
48,74585,Dep. Lincoln Portela,PL,MG,governo,Dep. Lincoln Portela (PL/-),2.3833333333333333
48,76874,Dep. Marcelo Freixo,PSOL,RJ,oposição,Dep. Marcelo Freixo (PSOL/-),2
48,90842,Dep. Santini,PTB,RS,governo,Dep. Santini (PTB/-),2.75
48,93083,Dep. Cacá Leão,PP,BA,governo,Dep. Cacá Leão (PP/-),0.8333333333333333
48,285,Sen. Marcio Bittar,MDB,AC,governo,Sen. Marcio Bittar (MDB/-),2
48,4560,Sen. Sérgio Petecão,PSD,AC,governo,Sen. Sérgio Petecão (PSD/-),1
48,5953,Sen. Fabiano Contarato,REDE,ES,oposição,Sen. Fabiano Contarato (REDE/-),1
48,177282,Dep. Subtenente Gonzaga,PDT,MG,oposição,Dep. Subtenente Gonzaga (PDT/-),0.75
48,204507,Dep. Carla Zambelli,PSL,SP,governo,Dep. Carla Zambelli (PSL/-),0.8333333333333333
48,178835,Dep. Afonso Motta,PDT,RS,oposição,Dep. Afonso Motta (PDT/-),1.3333333333333333
48,204416,Dep. Sanderson,PSL,RS,governo,Dep. Sanderson (PSL/-),1
48,204439,Dep. Dr. Leonardo,SOLIDARIEDADE,MT,governo,Dep. Dr. Leonardo (SOLIDARIEDADE/-),2.6666666666666665
48,204490,Dep. Charlles Evangelista,PSL,MG,governo,Dep. Charlles Evangelista (PSL/-),0.875
48,204500,Dep. Eduardo Costa,PTB,PA,governo,Dep. Eduardo Costa (PTB/-),0.75
48,204425,Dep. Silvio Costa Filho,PRB,PE,governo,Dep. Silvio Costa Filho (PRB/-),0.8
48,204544,Dep. Alexandre Frota,PSL,SP,governo,Dep. Alexandre Frota (PSL/-),0.6666666666666666
49,5895,Sen. Jorge Kajuru,PSB,GO,oposição,Sen. Jorge Kajuru (PSB/GO),1
49,5953,Sen. Fabiano Contarato,REDE,ES,oposição,Sen. Fabiano Contarato (REDE/ES),2
49,5967,Sen. Angelo Coronel,PSD,BA,governo,Sen. Angelo Coronel (PSD/BA),2
50,133439,Sen. André Figueiredo,PDT,CE,oposição,Sen. André Figueiredo (PDT/CE),4
50,141470,Sen. José Guimarães,PT,CE,oposição,Sen. José Guimarães (PT/CE),2
50,141513,Sen. Bilac Pinto,DEM,MG,governo,Sen. Bilac Pinto (DEM/MG),1
50,141531,Sen. Rodrigo de Castro,PSDB,MG,governo,Sen. Rodrigo de Castro (PSDB/MG),3
50,141555,Sen. Vinicius Carvalho,PRB,SP,governo,Sen. Vinicius Carvalho (PRB/SP),3
50,157130,Sen. Túlio Gadêlha,PDT,PE,oposição,Sen. Túlio Gadêlha (PDT/PE),2
50,160511,Sen. Alessandro Molon,PSB,RJ,oposição,Sen. Alessandro Molon (PSB/RJ),6
50,160528,Sen. Danilo Cabral,PSB,PE,oposição,Sen. Danilo Cabral (PSB/PE),2
50,160532,Sen. Eli Corrêa Filho,DEM,SP,governo,Sen. Eli Corrêa Filho (DEM/SP),2
50,171619,Sen. Margarida Salomão,PT,MG,oposição,Sen. Margarida Salomão (PT/MG),1
50,178842,Sen. Jhc,PSB,AL,oposição,Sen. Jhc (PSB/AL),1
50,178874,Sen. Sergio Vidigal,PDT,ES,oposição,Sen. Sergio Vidigal (PDT/ES),2
50,178916,Sen. Daniel Coelho,PPS,PE,governo,Sen. Daniel Coelho (PPS/PE),1
50,178977,Sen. Eduardo Cury,PSDB,SP,governo,Sen. Eduardo Cury (PSDB/SP),3
50,178987,Sen. Orlando Silva,PCdoB,SP,oposição,Sen. Orlando Silva (PCdoB/SP),28
50,204365,Sen. Gilson Marques,NOVO,SC,governo,Sen. Gilson Marques (NOVO/SC),3
50,204371,Sen. Felipe Rigoni,PSB,ES,oposição,Sen. Felipe Rigoni (PSB/ES),5
50,204374,Sen. Bia Kicis,"",DF,governo,Sen. Bia Kicis (/DF),2
50,204381,Sen. Luis Miranda,DEM,DF,governo,Sen. Luis Miranda (DEM/DF),2
50,204391,Sen. José Nelto,PODE,GO,governo,Sen. José Nelto (PODE/GO),1
50,204406,Sen. Pedro Westphalen,PP,RS,governo,Sen. Pedro Westphalen (PP/RS),1
50,204425,Sen. Silvio Costa Filho,PRB,PE,governo,Sen. Silvio Costa Filho (PRB/PE),9
50,204453,Sen. Natália Bonavides,PT,RN,oposição,Sen. Natália Bonavides (PT/RN),5
50,204464,Sen. Talíria Petrone,PSOL,RJ,oposição,Sen. Talíria Petrone (PSOL/RJ),9
50,204504,Sen. Cezinha de Madureira,PSD,SP,governo,Sen. Cezinha de Madureira (PSD/SP),1
50,204532,Sen. Vinicius Poit,NOVO,SP,governo,Sen. Vinicius Poit (NOVO/SP),2
50,204535,Sen. Sâmia Bomfim,PSOL,SP,oposição,Sen. Sâmia Bomfim (PSOL/SP),9
50,204548,Sen. Heitor Freire,PSL,CE,governo,Sen. Heitor Freire (PSL/CE),3
50,22,Sen. Esperidião Amin,PP,SC,governo,Sen. Esperidião Amin (PP/SC),2
50,3777,Sen. Eduardo Gomes,MDB,TO,governo,Sen. Eduardo Gomes (MDB/TO),3
50,4770,Sen. Izalci Lucas,PSDB,DF,governo,Sen. Izalci Lucas (PSDB/DF),16
50,5008,Sen. Humberto Costa,PT,PE,oposição,Sen. Humberto Costa (PT/PE),9
50,5350,Sen. Jorginho Mello,PL,SC,governo,Sen. Jorginho Mello (PL/SC),1
50,5352,Sen. Rogério Carvalho,PT,SE,oposição,Sen. Rogério Carvalho (PT/SE),7
50,5385,Sen. Irajá,PSD,TO,governo,Sen. Irajá (PSD/TO),1
50,5411,Sen. Weverton,PDT,MA,oposição,Sen. Weverton (PDT/MA),2
50,5523,Sen. Otto Alencar,PSD,BA,governo,Sen. Otto Alencar (PSD/BA),1
50,5732,Sen. Rodrigo Pacheco,DEM,MG,governo,Sen. Rodrigo Pacheco (DEM/MG),1
50,5924,Sen. Oriovisto Guimarães,PODEMOS,PR,governo,Sen. Oriovisto Guimarães (PODEMOS/PR),3
50,5988,Sen. Soraya Thronicke,PSL,MS,governo,Sen. Soraya Thronicke (PSL/MS),1
50,73441,Sen. Celso Russomanno,PRB,SP,governo,Sen. Celso Russomanno (PRB/SP),5
50,73460,Sen. Gustavo Fruet,PDT,PR,oposição,Sen. Gustavo Fruet (PDT/PR),1
50,73531,Sen. Ivan Valente,PSOL,SP,oposição,Sen. Ivan Valente (PSOL/SP),9
50,74400,Sen. Paulo Pimenta,PT,RS,oposição,Sen. Paulo Pimenta (PT/RS),7
50,74655,Sen. Eduardo Barbosa,PSDB,MG,governo,Sen. Eduardo Barbosa (PSDB/MG),1
50,76874,Sen. Marcelo Freixo,PSOL,RJ,oposição,Sen. Marcelo Freixo (PSOL/RJ),9
51,374,Sen. Paulo Rocha,PT,PA,oposição,Sen. Paulo Rocha (PT/PA),0.8888888888888888
