id_leggo,id_autor,nome,partido,uf,bancada,nome_eleitoral,node_size
27,164360,Dep. Carmen Zanotto,CIDADANIA,SC,governo,Dep. Carmen Zanotto (CIDADANIA/SC),1.6904761904761905
27,177282,Dep. Subtenente Gonzaga,PDT,MG,oposição,Dep. Subtenente Gonzaga (PDT/MG),4.2
27,178829,Dep. Capitão Augusto,PL,SP,governo,Dep. Capitão Augusto (PL/SP),2.5
27,178832,Dep. Leandre,PV,PR,governo,Dep. Leandre (PV/PR),0.8333333333333333
27,178835,Dep. Afonso Motta,PDT,RS,oposição,Dep. Afonso Motta (PDT/RS),3.8
27,178836,Dep. Alan Rick,DEM,AC,governo,Dep. Alan Rick (DEM/AC),3
27,178842,Dep. Jhc,PSB,AL,oposição,Dep. Jhc (PSB/AL),1
27,178854,Dep. Elmar Nascimento,DEM,BA,governo,Dep. Elmar Nascimento (DEM/BA),4
27,178857,Dep. Jorge Solla,PT,BA,oposição,Dep. Jorge Solla (PT/BA),38.726190476190474
27,178860,Dep. Paulo Azi,DEM,,governo,Dep. Paulo Azi (DEM/NA),3
27,178881,Dep. Aluisio Mendes,PODE,MA,governo,Dep. Aluisio Mendes (PODE/MA),1.8
27,178882,Dep. André Fufuca,PP,MA,governo,Dep. André Fufuca (PP/MA),1
27,178884,Dep. Hildo Rocha,MDB,MA,governo,Dep. Hildo Rocha (MDB/MA),2
27,178916,Dep. Daniel Coelho,CIDADANIA,PE,governo,Dep. Daniel Coelho (CIDADANIA/PE),2
27,178921,Dep. Sebastião Oliveira,PL,PE,governo,Dep. Sebastião Oliveira (PL/PE),1
27,178922,Dep. Tadeu Alencar,PSB,PE,oposição,Dep. Tadeu Alencar (PSB/PE),10.875
27,178927,Dep. Aliel Machado,PSB,PR,oposição,Dep. Aliel Machado (PSB/PR),4.375
27,178929,Dep. Diego Garcia,PODE,PR,governo,Dep. Diego Garcia (PODE/PR),5
27,178931,Dep. Luciano Ducci,PSB,PR,oposição,Dep. Luciano Ducci (PSB/PR),5
27,178939,Dep. Clarissa Garotinho,PROS,RJ,governo,Dep. Clarissa Garotinho (PROS/RJ),4
27,178946,Dep. Soraya Santos,PL,RJ,governo,Dep. Soraya Santos (PL/RJ),5.690476190476191
27,178953,Dep. Expedito Netto,PSD,RO,governo,Dep. Expedito Netto (PSD/RO),1
27,178959,Dep. Hiran Gonçalves,PP,RR,governo,Dep. Hiran Gonçalves (PP/RR),2
27,178964,Dep. Heitor Schuch,PSB,RS,oposição,Dep. Heitor Schuch (PSB/RS),2.5
27,178966,Dep. Geovania De Sá,PSDB,SC,governo,Dep. Geovania De Sá (PSDB/SC),1
27,178975,Dep. Baleia Rossi,MDB,SP,governo,Dep. Baleia Rossi (MDB/SP),3.833333333333333
27,178977,Dep. Eduardo Cury,PSDB,SP,governo,Dep. Eduardo Cury (PSDB/SP),3
27,178981,Dep. Herculano Passos,MDB,SP,governo,Dep. Herculano Passos (MDB/SP),1
27,178987,Dep. Orlando Silva,PCdoB,SP,oposição,Dep. Orlando Silva (PCdoB/SP),5.732142857142857
27,178989,Dep. Renata Abreu,PODE,SP,governo,Dep. Renata Abreu (PODE/SP),3
27,178990,Dep. Samuel Moreira,PSDB,SP,governo,Dep. Samuel Moreira (PSDB/SP),7
27,178994,Dep. Dulce Miranda,MDB,TO,governo,Dep. Dulce Miranda (MDB/TO),0.8333333333333333
27,191923,Dep. Flavio Nogueira,PDT,PI,oposição,Dep. Flavio Nogueira (PDT/PI),1
27,198197,Dep. Greyce Elias,AVANTE,MG,governo,Dep. Greyce Elias (AVANTE/MG),1
27,198783,Dep. Emanuel Pinheiro Neto,PTB,MT,governo,Dep. Emanuel Pinheiro Neto (PTB/MT),3
27,204354,Dep. Flávia Arruda,PL,DF,governo,Dep. Flávia Arruda (PL/DF),3
27,204357,Dep. Rose Modesto,PSDB,MS,governo,Dep. Rose Modesto (PSDB/MS),0.8
27,204358,Dep. Beto Pereira,PSDB,MS,governo,Dep. Beto Pereira (PSDB/MS),1
27,204359,Dep. Léo Moraes,PODE,RO,governo,Dep. Léo Moraes (PODE/RO),8.857142857142858
27,204365,Dep. Gilson Marques,NOVO,SC,governo,Dep. Gilson Marques (NOVO/SC),1.75
27,204366,Dep. Rodrigo Coelho,PSB,SC,oposição,Dep. Rodrigo Coelho (PSB/SC),5
27,204367,Dep. Daniel Freitas,PSL,SC,governo,Dep. Daniel Freitas (PSL/SC),1
27,204371,Dep. Felipe Rigoni,PSB,ES,oposição,Dep. Felipe Rigoni (PSB/ES),6.916666666666666
27,204372,Dep. Julio Cesar Ribeiro,PRB,DF,governo,Dep. Julio Cesar Ribeiro (PRB/DF),2
27,204377,Dep. Paula Belmonte,CIDADANIA,DF,governo,Dep. Paula Belmonte (CIDADANIA/DF),0.6666666666666666
27,204380,Dep. Celina Leão,PP,DF,governo,Dep. Celina Leão (PP/DF),2.8
27,204381,Dep. Luis Miranda,DEM,DF,governo,Dep. Luis Miranda (DEM/DF),2
27,204383,Dep. Professor Israel Batista,PV,DF,governo,Dep. Professor Israel Batista (PV/DF),14.916666666666668
27,204385,Dep. Valdevan Noventa,PSC,SE,governo,Dep. Valdevan Noventa (PSC/SE),1
27,204387,Dep. Sargento Fahur,PSD,,governo,Dep. Sargento Fahur (PSD/NA),1.9
27,204392,Dep. Francisco Jr.,PSD,GO,governo,Dep. Francisco Jr. (PSD/GO),1
27,204394,Dep. Gervásio Maia,PSB,PB,oposição,Dep. Gervásio Maia (PSB/PB),0.875
27,204397,Dep. Boca Aberta,PROS,PR,governo,Dep. Boca Aberta (PROS/PR),2
27,204398,Dep. Felipe Francischini,PSL,PR,governo,Dep. Felipe Francischini (PSL/PR),1
27,204407,Dep. Fernanda Melchionna,PSOL,RS,oposição,Dep. Fernanda Melchionna (PSOL/RS),3.6
27,204409,Dep. Daniel Trzeciak,PSDB,RS,governo,Dep. Daniel Trzeciak (PSDB/RS),1
27,204416,Dep. Sanderson,PSL,RS,governo,Dep. Sanderson (PSL/RS),1.3
27,204421,Dep. Edna Henrique,PSDB,PB,governo,Dep. Edna Henrique (PSDB/PB),0.8
27,204425,Dep. Silvio Costa Filho,PRB,PE,governo,Dep. Silvio Costa Filho (PRB/PE),1
27,204426,Dep. Carlos Veras,PT,PE,oposição,Dep. Carlos Veras (PT/PE),15.726190476190476
27,204427,Dep. Fernando Rodolfo,PL,PE,governo,Dep. Fernando Rodolfo (PL/PE),4
27,204428,Dep. Marília Arraes,PT,PE,oposição,Dep. Marília Arraes (PT/PE),2
27,204429,Dep. João H. Campos,PSB,PE,oposição,Dep. João H. Campos (PSB/PE),1.875
27,204434,Dep. Dra. Vanda Milani,SOLIDARIEDADE,AC,governo,Dep. Dra. Vanda Milani (SOLIDARIEDADE/AC),1
27,204436,Dep. Isnaldo Bulhões Jr.,MDB,AL,governo,Dep. Isnaldo Bulhões Jr. (MDB/AL),2
27,204439,Dep. Dr. Leonardo,SOLIDARIEDADE,MT,governo,Dep. Dr. Leonardo (SOLIDARIEDADE/MT),1
27,204440,Dep. Christino Aureo,PP,RJ,governo,Dep. Christino Aureo (PP/RJ),1
27,204441,Dep. Otoni De Paula,PSC,RJ,governo,Dep. Otoni De Paula (PSC/RJ),1
27,204442,Dep. Gurgel,PSL,RJ,governo,Dep. Gurgel (PSL/RJ),0.9000000000000001
27,204454,Dep. Daniel Silveira,PSL,RJ,governo,Dep. Daniel Silveira (PSL/RJ),1
27,204456,Dep. Gutemberg Reis,MDB,RJ,governo,Dep. Gutemberg Reis (MDB/RJ),1
27,204461,Dep. Paulo Ganime,NOVO,RJ,governo,Dep. Paulo Ganime (NOVO/RJ),2.75
27,204463,Dep. Wladimir Garotinho,PSD,RJ,governo,Dep. Wladimir Garotinho (PSD/RJ),2
27,204464,Dep. Talíria Petrone,PSOL,RJ,oposição,Dep. Talíria Petrone (PSOL/RJ),7.1000000000000005
27,204466,Dep. Tereza Nelma,PSDB,AL,governo,Dep. Tereza Nelma (PSDB/AL),2.3
27,204467,Dep. Professora Rosa Neide,PT,MT,oposição,Dep. Professora Rosa Neide (PT/MT),1.5
27,204468,Dep. Joenia Wapichana,REDE,RR,oposição,Dep. Joenia Wapichana (REDE/RR),1.75
27,204471,Dep. Mara Rocha,PSDB,AC,governo,Dep. Mara Rocha (PSDB/AC),0.8
27,204476,Dep. Chiquinho Brazão,AVANTE,RJ,governo,Dep. Chiquinho Brazão (AVANTE/RJ),2
27,204477,Dep. Felício Laterça,PSL,RJ,governo,Dep. Felício Laterça (PSL/RJ),2.2666666666666666
27,204479,Dep. Nicoletti,PSL,RR,governo,Dep. Nicoletti (PSL/RR),1
27,204482,Dep. Euclydes Pettersen,PSC,MG,governo,Dep. Euclydes Pettersen (PSC/MG),1
27,204483,Dep. Vilson Da Fetaemg,PSB,MG,oposição,Dep. Vilson Da Fetaemg (PSB/MG),1
27,204486,Dep. Mauro Benevides Filho,PDT,,oposição,Dep. Mauro Benevides Filho (PDT/NA),3.5
27,204487,Dep. Capitão Wagner,PROS,CE,governo,Dep. Capitão Wagner (PROS/CE),4.699999999999999
27,204488,Dep. Célio Studart,PV,CE,governo,Dep. Célio Studart (PV/CE),0.8571428571428571
27,204490,Dep. Charlles Evangelista,PSL,MG,governo,Dep. Charlles Evangelista (PSL/MG),1
27,204494,Dep. Fred Costa,PATRIOTA,MG,governo,Dep. Fred Costa (PATRIOTA/MG),2.6904761904761907
27,204496,Dep. Celso Sabino,PSDB,PA,governo,Dep. Celso Sabino (PSDB/PA),1
27,204499,Dep. Cássio Andrade,PSB,PA,oposição,Dep. Cássio Andrade (PSB/PA),0.875
27,204500,Dep. Eduardo Costa,PTB,PA,governo,Dep. Eduardo Costa (PTB/PA),5.5
27,204506,Dep. Marcos Pereira,PRB,SP,governo,Dep. Marcos Pereira (PRB/SP),2
27,204509,Dep. Áurea Carolina,PSOL,MG,oposição,Dep. Áurea Carolina (PSOL/MG),3.6000000000000005
27,204512,Dep. Delegado Marcelo Freitas,PSL,MG,governo,Dep. Delegado Marcelo Freitas (PSL/MG),5.266666666666667
27,204514,Dep. Coronel Tadeu,PSL,SP,governo,Dep. Coronel Tadeu (PSL/SP),2.9
27,204516,Dep. Alexis Fonteyne,NOVO,SP,governo,Dep. Alexis Fonteyne (NOVO/SP),1.75
27,204517,Dep. Zé Vitor,PL,MG,governo,Dep. Zé Vitor (PL/MG),1
27,204518,Dep. Dr. Frederico,PATRIOTA,MG,governo,Dep. Dr. Frederico (PATRIOTA/MG),6.19047619047619
27,204519,Dep. Tiago Mitraud,NOVO,MG,governo,Dep. Tiago Mitraud (NOVO/MG),4.75
27,204520,Dep. Cabo Junio Amaral,PSL,MG,governo,Dep. Cabo Junio Amaral (PSL/MG),0.9000000000000001
27,204522,Dep. Marco Bertaiolli,PSD,SP,governo,Dep. Marco Bertaiolli (PSD/SP),2
27,204523,Dep. Lucas Gonzalez,NOVO,MG,governo,Dep. Lucas Gonzalez (NOVO/MG),1.75
27,204527,Dep. Geninho Zuliani,DEM,SP,governo,Dep. Geninho Zuliani (DEM/SP),1
27,204528,Dep. Adriana Ventura,NOVO,SP,governo,Dep. Adriana Ventura (NOVO/SP),2.75
27,204531,Dep. Guilherme Derrite,PP,,governo,Dep. Guilherme Derrite (PP/NA),2.9
27,204533,Dep. Idilvan Alencar,PDT,CE,oposição,Dep. Idilvan Alencar (PDT/CE),1
27,204535,Dep. Sâmia Bomfim,PSOL,SP,oposição,Dep. Sâmia Bomfim (PSOL/SP),14.933333333333334
27,204536,Dep. Kim Kataguiri,DEM,SP,governo,Dep. Kim Kataguiri (DEM/SP),1
27,204537,Dep. Enrico Misasi,PV,SP,governo,Dep. Enrico Misasi (PV/SP),1
27,204541,Dep. Eduardo Bismarck,PDT,CE,oposição,Dep. Eduardo Bismarck (PDT/CE),2.8
27,204542,Dep. Denis Bezerra,PSB,CE,oposição,Dep. Denis Bezerra (PSB/CE),2
27,204543,Dep. Luiz Flávio Gomes,PSB,SP,oposição,Dep. Luiz Flávio Gomes (PSB/SP),1.875
27,204553,Dep. Pastor Sargento Isidório,AVANTE,BA,governo,Dep. Pastor Sargento Isidório (AVANTE/BA),1.9
27,204556,Dep. Marcelo Ramos,PL,AM,governo,Dep. Marcelo Ramos (PL/AM),2
27,204557,Dep. Sidney Leite,PSD,AM,governo,Dep. Sidney Leite (PSD/AM),4
27,204561,Dep. Bira Do Pindaré,PSB,MA,oposição,Dep. Bira Do Pindaré (PSB/MA),2
27,204563,Dep. Josimar Maranhãozinho,PL,MA,governo,Dep. Josimar Maranhãozinho (PL/MA),3
27,204566,Dep. Marreca Filho,PATRIOTA,MA,governo,Dep. Marreca Filho (PATRIOTA/MA),2.333333333333333
27,204572,Dep. Capitão Alberto Neto,PRB,AM,governo,Dep. Capitão Alberto Neto (PRB/AM),2.9000000000000004
27,204574,Dep. Junior Lourenço,PL,,governo,Dep. Junior Lourenço (PL/NA),2
27,204575,Dep. Gil Cutrim,PDT,MA,oposição,Dep. Gil Cutrim (PDT/MA),3.8
27,204576,Dep. João Roma,PRB,BA,governo,Dep. João Roma (PRB/BA),1
27,209189,Dep. Joseildo Ramos,PT,BA,oposição,Dep. Joseildo Ramos (PT/BA),1
27,67138,Dep. Iracema Portella,PP,PI,governo,Dep. Iracema Portella (PP/PI),2
27,68720,Dep. Fábio Henrique,PDT,SE,oposição,Dep. Fábio Henrique (PDT/SE),5.5
27,69871,Dep. Bacelar,PODE,BA,governo,Dep. Bacelar (PODE/BA),1
27,73460,Dep. Gustavo Fruet,PDT,PR,oposição,Dep. Gustavo Fruet (PDT/PR),0.5
27,73482,Dep. Henrique Fontana,PT,RS,oposição,Dep. Henrique Fontana (PT/RS),20.726190476190474
27,73486,Dep. Pompeo De Mattos,PDT,RS,oposição,Dep. Pompeo De Mattos (PDT/RS),4.8
27,73531,Dep. Ivan Valente,PSOL,SP,oposição,Dep. Ivan Valente (PSOL/SP),15.933333333333334
27,73586,Dep. Júlio Delgado,PSB,MG,oposição,Dep. Júlio Delgado (PSB/MG),2.875
27,73801,Dep. Renildo Calheiros,PCdoB,PE,oposição,Dep. Renildo Calheiros (PCdoB/PE),4.875
27,73891,Dep. Darcísio Perondi,MDB,RS,governo,Dep. Darcísio Perondi (MDB/RS),2
27,73943,Dep. Perpétua Almeida,PCdoB,AC,oposição,Dep. Perpétua Almeida (PCdoB/AC),12.375
27,74043,Dep. Wellington Roberto,PL,PB,governo,Dep. Wellington Roberto (PL/PB),2
27,74044,Dep. Wilson Santiago,PTB,PB,governo,Dep. Wilson Santiago (PTB/PB),1.5
27,74057,Dep. Alice Portugal,PCdoB,BA,oposição,Dep. Alice Portugal (PCdoB/BA),16.375
27,74060,Dep. Daniel Almeida,PCdoB,BA,oposição,Dep. Daniel Almeida (PCdoB/BA),5.375
27,74156,Dep. Leonardo Monteiro,PT,MG,oposição,Dep. Leonardo Monteiro (PT/MG),1
27,74158,Dep. Mário Heringer,PDT,MG,oposição,Dep. Mário Heringer (PDT/MG),1
27,74159,Dep. Odair Cunha,PT,MG,oposição,Dep. Odair Cunha (PT/MG),1
27,74161,Dep. Reginaldo Lopes,PT,MG,oposição,Dep. Reginaldo Lopes (PT/MG),3
27,74262,Dep. Carlos Sampaio,PSDB,SP,governo,Dep. Carlos Sampaio (PSDB/SP),4
27,74305,Dep. Roberto Pessoa,PSDB,CE,governo,Dep. Roberto Pessoa (PSDB/CE),1
27,74317,Dep. Júlio Cesar,PSD,PI,governo,Dep. Júlio Cesar (PSD/PI),1
27,74366,Dep. João Campos,PRB,GO,governo,Dep. João Campos (PRB/GO),9.333333333333332
27,74371,Dep. Rubens Otoni,PT,GO,oposição,Dep. Rubens Otoni (PT/GO),1.75
27,74571,Dep. Nelson Pellegrino,PT,BA,oposição,Dep. Nelson Pellegrino (PT/BA),1.5
27,74585,Dep. Lincoln Portela,PL,MG,governo,Dep. Lincoln Portela (PL/MG),3
27,74655,Dep. Eduardo Barbosa,PSDB,MG,governo,Dep. Eduardo Barbosa (PSDB/MG),1.5
27,74784,Dep. Luiza Erundina,PSOL,SP,oposição,Dep. Luiza Erundina (PSOL/SP),8.933333333333334
27,74848,Dep. Jandira Feghali,PCdoB,RJ,oposição,Dep. Jandira Feghali (PCdoB/RJ),5.375
27,76874,Dep. Marcelo Freixo,PSOL,RJ,oposição,Dep. Marcelo Freixo (PSOL/RJ),4.1000000000000005
27,81055,Dep. Márcio Jerry,PCdoB,MA,oposição,Dep. Márcio Jerry (PCdoB/MA),4.375
27,90842,Dep. Santini,PTB,RS,governo,Dep. Santini (PTB/RS),2
27,1173,Sen. Wellington Fagundes,PR,MT,governo,Sen. Wellington Fagundes (PR/MT),1
27,1186,Sen. Luis Carlos Heinze,PP,RS,governo,Sen. Luis Carlos Heinze (PP/RS),1
27,22,Sen. Esperidião Amin,PP,SC,governo,Sen. Esperidião Amin (PP/SC),1
27,2331,Sen. Rose de Freitas,PMDB,ES,governo,Sen. Rose de Freitas (PMDB/ES),11
27,285,Sen. Marcio Bittar,MDB,AC,governo,Sen. Marcio Bittar (MDB/AC),1
27,3361,Sen. José Maranhão,MDB,PB,governo,Sen. José Maranhão (MDB/PB),4
27,3396,Sen. Tasso Jereissati,PSDB,CE,governo,Sen. Tasso Jereissati (PSDB/CE),13
27,35,Sen. Jader Barbalho,MDB,PA,governo,Sen. Jader Barbalho (MDB/PA),1
27,374,Sen. Paulo Rocha,PT,PA,oposição,Sen. Paulo Rocha (PT/PA),39
27,4981,Sen. Acir Gurgacz,PDT,RO,oposição,Sen. Acir Gurgacz (PDT/RO),2
27,4994,Sen. Eduardo Braga,MDB,AM,governo,Sen. Eduardo Braga (MDB/AM),3
27,5008,Sen. Humberto Costa,PT,PE,oposição,Sen. Humberto Costa (PT/PE),53
27,5012,Sen. Randolfe Rodrigues,REDE,AP,oposição,Sen. Randolfe Rodrigues (REDE/AP),23
27,5350,Sen. Jorginho Mello,PL,SC,governo,Sen. Jorginho Mello (PL/SC),3
27,5352,Sen. Rogério Carvalho,PT,SE,oposição,Sen. Rogério Carvalho (PT/SE),34
27,5376,Sen. Mara Gabrilli,PSDB,SP,governo,Sen. Mara Gabrilli (PSDB/SP),1
27,5411,Sen. Weverton,PDT,MA,oposição,Sen. Weverton (PDT/MA),43
27,5422,Sen. Marcos Rogério,DEM,RO,governo,Sen. Marcos Rogério (DEM/RO),1
27,5502,Sen. Plínio Valério,PSDB,AM,governo,Sen. Plínio Valério (PSDB/AM),23
27,5523,Sen. Otto Alencar,PSD,BA,governo,Sen. Otto Alencar (PSD/BA),4
27,5529,Sen. Antonio Anastasia,PSDB,MG,governo,Sen. Antonio Anastasia (PSDB/MG),7
27,5533,Sen. Lasier Martins,PSD,RS,governo,Sen. Lasier Martins (PSD/RS),4
27,5535,Sen. Telmário Mota,PROS,RR,governo,Sen. Telmário Mota (PROS/RR),6
27,5537,Sen. Dário Berger,MDB,SC,governo,Sen. Dário Berger (MDB/SC),30
27,5540,Sen. Fernando Bezerra Coelho,PSB,PE,oposição,Sen. Fernando Bezerra Coelho (PSB/PE),1
27,5627,Sen. Jean Paul Prates,PT,RN,oposição,Sen. Jean Paul Prates (PT/RN),1
27,5666,Sen. Major Olimpio,PSL,SP,governo,Sen. Major Olimpio (PSL/SP),5
27,5718,Sen. Eliziane Gama,CIDADANIA,MA,governo,Sen. Eliziane Gama (CIDADANIA/MA),10
27,5732,Sen. Rodrigo Pacheco,DEM,MG,governo,Sen. Rodrigo Pacheco (DEM/MG),2
27,5748,Sen. Veneziano Vital do Rêgo,PSB,PB,oposição,Sen. Veneziano Vital do Rêgo (PSB/PB),24
27,581,Sen. Jaques Wagner,PT,BA,oposição,Sen. Jaques Wagner (PT/BA),22
27,5895,Sen. Jorge Kajuru,PSB,GO,oposição,Sen. Jorge Kajuru (PSB/GO),6
27,5905,Sen. Rodrigo Cunha,PSDB,AL,governo,Sen. Rodrigo Cunha (PSDB/AL),7
27,5924,Sen. Oriovisto Guimarães,PODEMOS,PR,governo,Sen. Oriovisto Guimarães (PODEMOS/PR),1
27,5929,Sen. Juíza Selma,PSL,MT,governo,Sen. Juíza Selma (PSL/MT),3
27,5942,Sen. Marcos do Val,PODEMOS,ES,governo,Sen. Marcos do Val (PODEMOS/ES),18
27,5953,Sen. Fabiano Contarato,REDE,ES,oposição,Sen. Fabiano Contarato (REDE/ES),10
27,5967,Sen. Angelo Coronel,PSD,BA,governo,Sen. Angelo Coronel (PSD/BA),3
27,5973,Sen. Cid Gomes,PDT,CE,oposição,Sen. Cid Gomes (PDT/CE),52
27,5979,Sen. Leila Barros,PSB,DF,oposição,Sen. Leila Barros (PSB/DF),12
27,5982,Sen. Alessandro Vieira,CIDADANIA,SE,governo,Sen. Alessandro Vieira (CIDADANIA/SE),8
27,5985,Sen. Nelsinho Trad,PSD,MS,governo,Sen. Nelsinho Trad (PSD/MS),1
27,5990,Sen. Carlos Viana,PSD,MG,governo,Sen. Carlos Viana (PSD/MG),5
27,6005,Sen. Siqueira Campos,DEM,TO,governo,Sen. Siqueira Campos (DEM/TO),6
27,6027,Sen. Mecias de Jesus,PRB,RR,governo,Sen. Mecias de Jesus (PRB/RR),1
27,70,Sen. Renan Calheiros,MDB,AL,governo,Sen. Renan Calheiros (MDB/AL),1
27,739,Sen. Ciro Nogueira,PP,PI,governo,Sen. Ciro Nogueira (PP/PI),1
27,825,Sen. Paulo Paim,PT,RS,oposição,Sen. Paulo Paim (PT/RS),57
27,90,Sen. José Serra,PSDB,SP,governo,Sen. José Serra (PSDB/SP),2
27,945,Sen. Alvaro Dias,PODEMOS,PR,governo,Sen. Alvaro Dias (PODEMOS/PR),3
27,205548,Dep. David Miranda,PSOL,RJ,oposição,Dep. David Miranda (PSOL/RJ),3.6
27,179001,Dep. Márcio Biolchi,MDB,RS,governo,Dep. Márcio Biolchi (MDB/RS),0.5
27,204501,Dep. Alencar Santana Braga,PT,SP,oposição,Dep. Alencar Santana Braga (PT/SP),1.5
27,204532,Dep. Vinicius Poit,NOVO,SP,governo,Dep. Vinicius Poit (NOVO/SP),2.25
27,178992,Dep. Vitor Lippi,PSDB,SP,governo,Dep. Vitor Lippi (PSDB/SP),0.5
27,204534,Dep. Tabata Amaral,PDT,SP,oposição,Dep. Tabata Amaral (PDT/SP),6.916666666666667
27,204569,Dep. Delegado Pablo,PSL,AM,governo,Dep. Delegado Pablo (PSL/AM),2.2666666666666666
27,207176,Dep. Bia Cavassa,PSDB,MS,governo,Dep. Bia Cavassa (PSDB/MS),0.8
27,141459,Dep. João Maia,PL,RN,governo,Dep. João Maia (PL/RN),0.5
27,5783,Sen. Zenaide Maia,PROS,RN,governo,Sen. Zenaide Maia (PROS/RN),1
28,133439,Dep. André Figueiredo,PDT,CE,oposição,Dep. André Figueiredo (PDT/CE),3
28,134812,Dep. Edmilson Rodrigues,PSOL,PA,oposição,Dep. Edmilson Rodrigues (PSOL/PA),20
28,137070,Dep. Vicentinho Júnior,PL,TO,governo,Dep. Vicentinho Júnior (PL/TO),2
28,141488,Dep. Paulo Teixeira,PT,SP,oposição,Dep. Paulo Teixeira (PT/SP),2
28,141508,Dep. Mauro Nazif,PSB,RO,oposição,Dep. Mauro Nazif (PSB/RO),2
28,141518,Dep. Paulo Pereira Da Silva,SOLIDARIEDADE,SP,governo,Dep. Paulo Pereira Da Silva (SOLIDARIEDADE/SP),2
28,157130,Dep. Túlio Gadêlha,PDT,PE,oposição,Dep. Túlio Gadêlha (PDT/PE),11
28,160511,Dep. Alessandro Molon,PSB,RJ,oposição,Dep. Alessandro Molon (PSB/RJ),11
28,160535,Dep. Marcon,PT,RS,oposição,Dep. Marcon (PT/RS),7
28,160538,Dep. Bohn Gass,PT,RS,oposição,Dep. Bohn Gass (PT/RS),6
28,160541,Dep. Arthur Lira,PP,AL,governo,Dep. Arthur Lira (PP/AL),1
28,160556,Dep. Padre João,PT,MG,oposição,Dep. Padre João (PT/MG),6
28,160558,Dep. Paulo Freire,PL,SP,governo,Dep. Paulo Freire (PL/SP),2
28,160568,Dep. Rogério Carvalho,PT,SE,oposição,Dep. Rogério Carvalho (PT/SE),9
28,160575,Dep. Erika Kokay,PT,DF,oposição,Dep. Erika Kokay (PT/DF),11
28,160604,Dep. Pedro Uczai,PT,SC,oposição,Dep. Pedro Uczai (PT/SC),2
28,160610,Dep. Valmir Assunção,PT,BA,oposição,Dep. Valmir Assunção (PT/BA),13
28,160639,Dep. Professora Dorinha Seabra Rezende,DEM,TO,governo,Dep. Professora Dorinha Seabra Rezende (DEM/TO),2
28,160653,Dep. Roberto De Lucena,PODE,SP,governo,Dep. Roberto De Lucena (PODE/SP),2
28,167722,Dep. Marcos Rogério,DEM,,governo,Dep. Marcos Rogério (DEM/NA),4
28,171619,Dep. Margarida Salomão,PT,MG,oposição,Dep. Margarida Salomão (PT/MG),2
28,177282,Dep. Subtenente Gonzaga,PDT,MG,oposição,Dep. Subtenente Gonzaga (PDT/MG),20
28,178826,Dep. Major Olimpio,PSL,SP,governo,Dep. Major Olimpio (PSL/SP),4
28,178829,Dep. Capitão Augusto,PL,SP,governo,Dep. Capitão Augusto (PL/SP),7
28,178857,Dep. Jorge Solla,PT,BA,oposição,Dep. Jorge Solla (PT/BA),2
28,178874,Dep. Sergio Vidigal,PDT,ES,oposição,Dep. Sergio Vidigal (PDT/ES),1
28,178883,Dep. Eliziane Gama,PPS,MA,governo,Dep. Eliziane Gama (PPS/MA),4
28,178884,Dep. Hildo Rocha,MDB,MA,governo,Dep. Hildo Rocha (MDB/MA),21
28,178887,Dep. Rubens Pereira Júnior,PCdoB,,oposição,Dep. Rubens Pereira Júnior (PCdoB/NA),9
28,178889,Dep. Zé Carlos,PT,MA,oposição,Dep. Zé Carlos (PT/MA),8
28,178916,Dep. Daniel Coelho,CIDADANIA,PE,governo,Dep. Daniel Coelho (CIDADANIA/PE),2
28,178970,Dep. João Daniel,PT,SE,oposição,Dep. João Daniel (PT/SE),10
28,178986,Dep. Nilto Tatto,PT,SP,oposição,Dep. Nilto Tatto (PT/SP),8
28,178987,Dep. Orlando Silva,PCdoB,SP,oposição,Dep. Orlando Silva (PCdoB/SP),4
28,204352,Dep. Camilo Capiberibe,PSB,AP,oposição,Dep. Camilo Capiberibe (PSB/AP),2
28,204369,Dep. Caroline De Toni,PSL,SC,governo,Dep. Caroline De Toni (PSL/SC),3
28,204371,Dep. Felipe Rigoni,PSB,ES,oposição,Dep. Felipe Rigoni (PSB/ES),2
28,204374,Dep. Bia Kicis,PSL,DF,governo,Dep. Bia Kicis (PSL/DF),4
28,204407,Dep. Fernanda Melchionna,PSOL,RS,oposição,Dep. Fernanda Melchionna (PSOL/RS),8
28,204453,Dep. Natália Bonavides,PT,RN,oposição,Dep. Natália Bonavides (PT/RN),4
28,204464,Dep. Talíria Petrone,PSOL,RJ,oposição,Dep. Talíria Petrone (PSOL/RJ),22
28,204466,Dep. Tereza Nelma,PSDB,AL,governo,Dep. Tereza Nelma (PSDB/AL),2
28,204467,Dep. Professora Rosa Neide,PT,MT,oposição,Dep. Professora Rosa Neide (PT/MT),4
28,204468,Dep. Joenia Wapichana,REDE,RR,oposição,Dep. Joenia Wapichana (REDE/RR),8
28,204480,Dep. Rogério Correia,PT,MG,oposição,Dep. Rogério Correia (PT/MG),2
28,204503,Dep. Alexandre Padilha,PT,SP,oposição,Dep. Alexandre Padilha (PT/SP),2
28,204509,Dep. Áurea Carolina,PSOL,MG,oposição,Dep. Áurea Carolina (PSOL/MG),22
28,204529,Dep. Policial Katia Sastre,PL,SP,governo,Dep. Policial Katia Sastre (PL/SP),3
28,204535,Dep. Sâmia Bomfim,PSOL,SP,oposição,Dep. Sâmia Bomfim (PSOL/SP),20
28,204555,Dep. José Ricardo,PT,AM,oposição,Dep. José Ricardo (PT/AM),9
28,204556,Dep. Marcelo Ramos,PL,AM,governo,Dep. Marcelo Ramos (PL/AM),1
28,204561,Dep. Bira Do Pindaré,PSB,MA,oposição,Dep. Bira Do Pindaré (PSB/MA),5
28,204576,Dep. João Roma,PRB,BA,governo,Dep. João Roma (PRB/BA),1
28,4931,Dep. Izalci Lucas,PSDB,DF,governo,Dep. Izalci Lucas (PSDB/DF),2
28,72442,Dep. Felipe Carreras,PSB,PE,oposição,Dep. Felipe Carreras (PSB/PE),2
28,73592,Dep. Kátia Abreu,PFL,TO,governo,Dep. Kátia Abreu (PFL/TO),1
28,73771,Dep. Flávio Arns,PT,PR,oposição,Dep. Flávio Arns (PT/PR),14
28,73910,Dep. Paulo Paim,PT,RS,oposição,Dep. Paulo Paim (PT/RS),10
28,73943,Dep. Perpétua Almeida,PCdoB,AC,oposição,Dep. Perpétua Almeida (PCdoB/AC),6
28,74057,Dep. Alice Portugal,PCdoB,BA,oposição,Dep. Alice Portugal (PCdoB/BA),13
28,74060,Dep. Daniel Almeida,PCdoB,BA,oposição,Dep. Daniel Almeida (PCdoB/BA),15
28,74082,Dep. Paulo Rocha,PT,PA,oposição,Dep. Paulo Rocha (PT/PA),21
28,74160,Dep. Patrus Ananias,PT,MG,oposição,Dep. Patrus Ananias (PT/MG),12
28,74270,Dep. Gilberto Nascimento,PSC,SP,governo,Dep. Gilberto Nascimento (PSC/SP),4
28,74366,Dep. João Campos,PRB,GO,governo,Dep. João Campos (PRB/GO),2
28,74376,Dep. Vander Loubet,PT,MS,oposição,Dep. Vander Loubet (PT/MS),2
28,74398,Dep. Maria Do Rosário,PT,RS,oposição,Dep. Maria Do Rosário (PT/RS),1
28,74400,Dep. Paulo Pimenta,PT,RS,oposição,Dep. Paulo Pimenta (PT/RS),21
28,74419,Dep. Gonzaga Patriota,PSB,PE,oposição,Dep. Gonzaga Patriota (PSB/PE),3
28,74548,Dep. Jaques Wagner,PT,BA,oposição,Dep. Jaques Wagner (PT/BA),14
28,74655,Dep. Eduardo Barbosa,PSDB,MG,governo,Dep. Eduardo Barbosa (PSDB/MG),1
28,74784,Dep. Luiza Erundina,PSOL,SP,oposição,Dep. Luiza Erundina (PSOL/SP),2
28,74848,Dep. Jandira Feghali,PCdoB,RJ,oposição,Dep. Jandira Feghali (PCdoB/RJ),5
28,76874,Dep. Marcelo Freixo,PSOL,RJ,oposição,Dep. Marcelo Freixo (PSOL/RJ),20
28,81055,Dep. Márcio Jerry,PCdoB,MA,oposição,Dep. Márcio Jerry (PCdoB/MA),6
28,92346,Dep. Eduardo Bolsonaro,PSL,SP,governo,Dep. Eduardo Bolsonaro (PSL/SP),1
28,1249,Sen. Kátia Abreu,PMDB,TO,governo,Sen. Kátia Abreu (PMDB/TO),1
28,141470,Sen. José Guimarães,PT,CE,oposição,Sen. José Guimarães (PT/CE),3
28,160508,Sen. Afonso Florence,PT,BA,oposição,Sen. Afonso Florence (PT/BA),3
28,204530,Sen. Rodrigo Agostinho,PSB,SP,oposição,Sen. Rodrigo Agostinho (PSB/SP),1
28,345,Sen. Flávio Arns,REDE,PR,oposição,Sen. Flávio Arns (REDE/PR),14.666666666666668
28,374,Sen. Paulo Rocha,PT,PA,oposição,Sen. Paulo Rocha (PT/PA),21
28,4770,Sen. Izalci Lucas,PSDB,DF,governo,Sen. Izalci Lucas (PSDB/DF),2
28,4981,Sen. Acir Gurgacz,PDT,RO,oposição,Sen. Acir Gurgacz (PDT/RO),2
28,5008,Sen. Humberto Costa,PT,PE,oposição,Sen. Humberto Costa (PT/PE),20
28,5012,Sen. Randolfe Rodrigues,REDE,AP,oposição,Sen. Randolfe Rodrigues (REDE/AP),9.666666666666666
28,5352,Sen. Rogério Carvalho,PT,SE,oposição,Sen. Rogério Carvalho (PT/SE),15
28,5422,Sen. Marcos Rogério,DEM,RO,governo,Sen. Marcos Rogério (DEM/RO),4
28,5535,Sen. Telmário Mota,PROS,RR,governo,Sen. Telmário Mota (PROS/RR),2
28,5540,Sen. Fernando Bezerra Coelho,PSB,PE,oposição,Sen. Fernando Bezerra Coelho (PSB/PE),5
28,5627,Sen. Jean Paul Prates,PT,RN,oposição,Sen. Jean Paul Prates (PT/RN),11
28,5666,Sen. Major Olimpio,PSL,SP,governo,Sen. Major Olimpio (PSL/SP),5
28,5718,Sen. Eliziane Gama,CIDADANIA,MA,governo,Sen. Eliziane Gama (CIDADANIA/MA),4
28,581,Sen. Jaques Wagner,PT,BA,oposição,Sen. Jaques Wagner (PT/BA),14
28,5895,Sen. Jorge Kajuru,PSB,GO,oposição,Sen. Jorge Kajuru (PSB/GO),1
28,5979,Sen. Leila Barros,PSB,DF,oposição,Sen. Leila Barros (PSB/DF),2
28,5982,Sen. Alessandro Vieira,CIDADANIA,SE,governo,Sen. Alessandro Vieira (CIDADANIA/SE),2
28,6027,Sen. Mecias de Jesus,PRB,RR,governo,Sen. Mecias de Jesus (PRB/RR),1
28,825,Sen. Paulo Paim,PT,RS,oposição,Sen. Paulo Paim (PT/RS),10
28,945,Sen. Alvaro Dias,PODEMOS,PR,governo,Sen. Alvaro Dias (PODEMOS/PR),1
28,5953,Sen. Fabiano Contarato,REDE,ES,oposição,Sen. Fabiano Contarato (REDE/ES),0.6666666666666666
29,164359,Dep. Delegado Waldir,PSL,GO,governo,Dep. Delegado Waldir (PSL/GO),1
29,178884,Dep. Hildo Rocha,MDB,MA,governo,Dep. Hildo Rocha (MDB/MA),1
29,204366,Dep. Rodrigo Coelho,PSB,SC,oposição,Dep. Rodrigo Coelho (PSB/SC),1
29,204506,Dep. Marcos Pereira,PRB,SP,governo,Dep. Marcos Pereira (PRB/SP),1
29,76874,Dep. Marcelo Freixo,PSOL,RJ,oposição,Dep. Marcelo Freixo (PSOL/RJ),1
30,164359,Dep. Delegado Waldir,PSL,GO,governo,Dep. Delegado Waldir (PSL/GO),1
