id_leggo,id_autor,nome,partido,uf,bancada,nome_eleitoral,node_size
1,160426,Dep. Rogério Rosso,PSD,DF,governo,Dep. Rogério Rosso (PSD/DF),1
1,285,Sen. Marcio Bittar,MDB,AC,governo,Sen. Marcio Bittar (MDB/AC),2
1,5008,Sen. Humberto Costa,PT,PE,oposição,Sen. Humberto Costa (PT/PE),1
1,5411,Sen. Weverton,PDT,MA,oposição,Sen. Weverton (PDT/MA),5
1,5533,Sen. Lasier Martins,PSD,RS,governo,Sen. Lasier Martins (PSD/RS),1
1,5535,Sen. Telmário Mota,PROS,RR,governo,Sen. Telmário Mota (PROS/RR),1
1,5585,Sen. Luiz do Carmo,MDB,GO,governo,Sen. Luiz do Carmo (MDB/GO),1
1,5666,Sen. Major Olimpio,PSL,SP,governo,Sen. Major Olimpio (PSL/SP),9
1,5718,Sen. Eliziane Gama,CIDADANIA,MA,governo,Sen. Eliziane Gama (CIDADANIA/MA),1
1,5732,Sen. Rodrigo Pacheco,DEM,MG,governo,Sen. Rodrigo Pacheco (DEM/MG),5
1,5895,Sen. Jorge Kajuru,PSB,GO,oposição,Sen. Jorge Kajuru (PSB/GO),1
1,5929,Sen. Juíza Selma,PSL,MT,governo,Sen. Juíza Selma (PSL/MT),9
1,5953,Sen. Fabiano Contarato,REDE,ES,oposição,Sen. Fabiano Contarato (REDE/ES),1
1,5967,Sen. Angelo Coronel,PSD,BA,governo,Sen. Angelo Coronel (PSD/BA),3
1,5982,Sen. Alessandro Vieira,CIDADANIA,SE,governo,Sen. Alessandro Vieira (CIDADANIA/SE),7
1,751,Sen. Arolde de Oliveira,PSD,RJ,governo,Sen. Arolde de Oliveira (PSD/RJ),3
1,945,Sen. Alvaro Dias,PODEMOS,PR,governo,Sen. Alvaro Dias (PODEMOS/PR),3
2,141516,Dep. Paulo Abi-Ackel,PSDB,MG,governo,Dep. Paulo Abi-Ackel (PSDB/MG),1.5
2,141536,Dep. Rômulo Gouveia,"",PB,governo,Dep. Rômulo Gouveia (/PB),1
2,160511,Dep. Alessandro Molon,PSB,RJ,oposição,Dep. Alessandro Molon (PSB/RJ),1
2,160515,Dep. Ronaldo Benedet,MDB,SC,governo,Dep. Ronaldo Benedet (MDB/SC),2
2,160559,Dep. Alceu Moreira,MDB,,governo,Dep. Alceu Moreira (MDB/NA),1
2,160636,Dep. Wilson Filho,PTB,PB,governo,Dep. Wilson Filho (PTB/PB),1
2,160643,Dep. Dr. Jorge Silva,SOLIDARIEDADE,ES,governo,Dep. Dr. Jorge Silva (SOLIDARIEDADE/ES),1
2,160677,Dep. Francisco Floriano,DEM,RJ,governo,Dep. Francisco Floriano (DEM/RJ),1
2,178896,Dep. Newton Cardoso Jr,MDB,MG,governo,Dep. Newton Cardoso Jr (MDB/MG),2
2,178908,Dep. Delegado Éder Mauro,PSD,PA,governo,Dep. Delegado Éder Mauro (PSD/PA),1
2,178954,Dep. Lucio Mosquini,MDB,RO,governo,Dep. Lucio Mosquini (MDB/RO),2
2,204536,Dep. Kim Kataguiri,DEM,SP,governo,Dep. Kim Kataguiri (DEM/SP),1
2,73569,Dep. Jorge Pinheiro,PRB,GO,governo,Dep. Jorge Pinheiro (PRB/GO),1
2,73655,Dep. Augusto Carvalho,SOLIDARIEDADE,DF,governo,Dep. Augusto Carvalho (SOLIDARIEDADE/DF),2
2,73928,Dep. Ann Pontes,PMDB,PA,governo,Dep. Ann Pontes (PMDB/PA),1
2,74153,Dep. Ivo José,PT,MG,oposição,Dep. Ivo José (PT/MG),1
2,74253,Dep. Julio Lopes,PP,RJ,governo,Dep. Julio Lopes (PP/RJ),0.5
2,74321,Dep. Betinho Rosado,PP**,RN,governo,Dep. Betinho Rosado (PP**/RN),1
2,74356,Dep. Silas Câmara,PRB,AM,governo,Dep. Silas Câmara (PRB/AM),1
2,74439,Dep. Wolney Queiroz,PDT,PE,oposição,Dep. Wolney Queiroz (PDT/PE),2
2,74665,Dep. Jaime Martins,PROS,MG,governo,Dep. Jaime Martins (PROS/MG),1
2,76874,Dep. Marcelo Freixo,PSOL,RJ,oposição,Dep. Marcelo Freixo (PSOL/RJ),1
3,204523,Dep. Lucas Gonzalez,NOVO,MG,governo,Dep. Lucas Gonzalez (NOVO/MG),1
3,1186,Sen. Luis Carlos Heinze,PP,RS,governo,Sen. Luis Carlos Heinze (PP/RS),1
3,4560,Sen. Sérgio Petecão,PSD,AC,governo,Sen. Sérgio Petecão (PSD/AC),1
4,133968,Dep. Paulo Ramos,PDT,RJ,oposição,Dep. Paulo Ramos (PDT/RJ),1
4,148134,Dep. Professor Victório Galli,PSL,MT,governo,Dep. Professor Victório Galli (PSL/MT),1
4,160632,Dep. Zé Silva,SOLIDARIEDADE,MG,governo,Dep. Zé Silva (SOLIDARIEDADE/MG),1
4,178835,Dep. Afonso Motta,PDT,RS,oposição,Dep. Afonso Motta (PDT/RS),1
4,178858,Dep. Mário Negromonte Jr.,PP,BA,governo,Dep. Mário Negromonte Jr. (PP/BA),1
4,178930,Dep. Evandro Roman,PSD,PR,governo,Dep. Evandro Roman (PSD/PR),1
4,178970,Dep. João Daniel,PT,SE,oposição,Dep. João Daniel (PT/SE),2
4,178986,Dep. Nilto Tatto,PT,SP,oposição,Dep. Nilto Tatto (PT/SP),1
4,204478,Dep. Vinicius Farah,MDB,RJ,governo,Dep. Vinicius Farah (MDB/RJ),1
4,72442,Dep. Felipe Carreras,PSB,PE,oposição,Dep. Felipe Carreras (PSB/PE),2
4,73459,Dep. Dr. Rosinha,PT,PR,oposição,Dep. Dr. Rosinha (PT/PR),1
4,74400,Dep. Paulo Pimenta,PT,RS,oposição,Dep. Paulo Pimenta (PT/RS),1
5,160531,Dep. Jhonatan De Jesus,PRB,RR,governo,Dep. Jhonatan De Jesus (PRB/RR),1
5,204544,Dep. Alexandre Frota,PSL,SP,governo,Dep. Alexandre Frota (PSL/SP),1
6,141417,Dep. Edio Lopes,PL,RR,governo,Dep. Edio Lopes (PL/RR),3
6,141448,Dep. Homero Pereira,PSD,,governo,Dep. Homero Pereira (PSD/NA),1
6,148134,Dep. Professor Victório Galli,PSL,MT,governo,Dep. Professor Victório Galli (PSL/MT),1
6,160559,Dep. Alceu Moreira,MDB,,governo,Dep. Alceu Moreira (MDB/NA),2
6,160600,Dep. Arthur Oliveira Maia,DEM,BA,governo,Dep. Arthur Oliveira Maia (DEM/BA),1
6,160670,Dep. Padre Ton,PT,RO,oposição,Dep. Padre Ton (PT/RO),1
6,166401,Dep. Nilson Leitão,PSDB,MT,governo,Dep. Nilson Leitão (PSDB/MT),1
6,178963,Dep. Covatti Filho,PP,,governo,Dep. Covatti Filho (PP/NA),2
6,204478,Dep. Vinicius Farah,MDB,RJ,governo,Dep. Vinicius Farah (MDB/RJ),1
6,73933,Dep. Zequinha Marinho,PSC,,governo,Dep. Zequinha Marinho (PSC/NA),1
6,74010,Dep. Valdir Colatto,MDB,SC,governo,Dep. Valdir Colatto (MDB/SC),1
6,74542,Dep. Félix Mendonça,DEM,BA,governo,Dep. Félix Mendonça (DEM/BA),1
6,74566,Dep. Geraldo Simões,PT,BA,oposição,Dep. Geraldo Simões (PT/BA),1
8,178970,Dep. João Daniel,PT,SE,oposição,Dep. João Daniel (PT/SE),1
8,178986,Dep. Nilto Tatto,PT,SP,oposição,Dep. Nilto Tatto (PT/SP),1
9,74171,Dep. Chico Alencar,PSOL,RJ,oposição,Dep. Chico Alencar (PSOL/RJ),1
10,141411,Dep. Dagoberto Nogueira,PDT,MS,oposição,Dep. Dagoberto Nogueira (PDT/MS),1
10,148134,Dep. Professor Victório Galli,PSL,MT,governo,Dep. Professor Victório Galli (PSL/MT),1
10,160531,Dep. Jhonatan De Jesus,PRB,RR,governo,Dep. Jhonatan De Jesus (PRB/RR),2
10,160642,Dep. Pastor Eurico,PATRIOTA,PE,governo,Dep. Pastor Eurico (PATRIOTA/PE),2
10,160672,Dep. Jean Wyllys,PSOL,,oposição,Dep. Jean Wyllys (PSOL/NA),1
10,164359,Dep. Delegado Waldir,PSL,GO,governo,Dep. Delegado Waldir (PSL/GO),2
10,178825,Dep. Leo De Brito,PT,,oposição,Dep. Leo De Brito (PT/NA),1
10,178938,Dep. Cabo Daciolo,PATRI,RJ,governo,Dep. Cabo Daciolo (PATRI/RJ),1
10,204374,Dep. Bia Kicis,PSL,DF,governo,Dep. Bia Kicis (PSL/DF),1
10,204407,Dep. Fernanda Melchionna,PSOL,RS,oposição,Dep. Fernanda Melchionna (PSOL/RS),1.4666666666666666
10,204441,Dep. Otoni De Paula,PSC,RJ,governo,Dep. Otoni De Paula (PSC/RJ),1
10,204444,Dep. Helio Lopes,PSL,RJ,governo,Dep. Helio Lopes (PSL/RJ),2
10,204453,Dep. Natália Bonavides,PT,RN,oposição,Dep. Natália Bonavides (PT/RN),1
10,204464,Dep. Talíria Petrone,PSOL,RJ,oposição,Dep. Talíria Petrone (PSOL/RJ),0.8
10,204478,Dep. Vinicius Farah,MDB,RJ,governo,Dep. Vinicius Farah (MDB/RJ),1
10,204503,Dep. Alexandre Padilha,PT,SP,oposição,Dep. Alexandre Padilha (PT/SP),1
10,204509,Dep. Áurea Carolina,PSOL,MG,oposição,Dep. Áurea Carolina (PSOL/MG),0.8
10,204535,Dep. Sâmia Bomfim,PSOL,SP,oposição,Dep. Sâmia Bomfim (PSOL/SP),1.4666666666666666
10,204542,Dep. Denis Bezerra,PSB,CE,oposição,Dep. Denis Bezerra (PSB/CE),1
10,204564,Dep. Igor Kannário,PHS,BA,governo,Dep. Igor Kannário (PHS/BA),1
10,4931,Dep. Izalci Lucas,PSDB,DF,governo,Dep. Izalci Lucas (PSDB/DF),1
10,74784,Dep. Luiza Erundina,PSOL,SP,oposição,Dep. Luiza Erundina (PSOL/SP),0.8
10,99654,Dep. Erivelton Santana,PATRI,BA,governo,Dep. Erivelton Santana (PATRI/BA),2
10,205548,Dep. David Miranda,PSOL,RJ,oposição,Dep. David Miranda (PSOL/RJ),0.6666666666666666
11,109152,Dep. Bernardo Santana De Vasconcellos,"",MG,governo,Dep. Bernardo Santana De Vasconcellos (/MG),1
11,114941,Dep. Josi Nunes,PROS,TO,governo,Dep. Josi Nunes (PROS/TO),1
11,116379,Dep. Darci De Matos,PSD,SC,governo,Dep. Darci De Matos (PSD/SC),1
11,134812,Dep. Edmilson Rodrigues,PSOL,PA,oposição,Dep. Edmilson Rodrigues (PSOL/PA),1
11,137070,Dep. Vicentinho Júnior,PL,TO,governo,Dep. Vicentinho Júnior (PL/TO),1
11,141401,Dep. Carlos Bezerra,MDB,,governo,Dep. Carlos Bezerra (MDB/NA),1
11,141411,Dep. Dagoberto Nogueira,PDT,MS,oposição,Dep. Dagoberto Nogueira (PDT/MS),1
11,141417,Dep. Edio Lopes,PL,RR,governo,Dep. Edio Lopes (PL/RR),1
11,141464,Dep. José Airton Cirilo,PT,CE,oposição,Dep. José Airton Cirilo (PT/CE),1
11,141478,Dep. Laerte Bessa,PR,DF,governo,Dep. Laerte Bessa (PR/DF),2
11,141498,Dep. Dr. Ubiali,PSB,SP,oposição,Dep. Dr. Ubiali (PSB/SP),1
11,141536,Dep. Rômulo Gouveia,"",PB,governo,Dep. Rômulo Gouveia (/PB),1
11,141555,Dep. Vinicius Carvalho,PRB,SP,governo,Dep. Vinicius Carvalho (PRB/SP),1
11,141562,Dep. Lelo Coimbra,MDB,ES,governo,Dep. Lelo Coimbra (MDB/ES),1
11,148134,Dep. Professor Victório Galli,PSL,MT,governo,Dep. Professor Victório Galli (PSL/MT),1
11,149327,Dep. Major Fábio,PROS,PB,governo,Dep. Major Fábio (PROS/PB),1
11,151208,Dep. Laercio Oliveira,PP,SE,governo,Dep. Laercio Oliveira (PP/SE),1
11,159238,Dep. Marcus Pestana,PSDB,MG,governo,Dep. Marcus Pestana (PSDB/MG),0.6666666666666666
11,160511,Dep. Alessandro Molon,PSB,RJ,oposição,Dep. Alessandro Molon (PSB/RJ),1
11,160545,Dep. Alexandre Leite,DEM,SP,governo,Dep. Alexandre Leite (DEM/SP),3
11,160559,Dep. Alceu Moreira,MDB,,governo,Dep. Alceu Moreira (MDB/NA),1
11,160571,Dep. João Rodrigues,PSD,,governo,Dep. João Rodrigues (PSD/NA),2
11,160596,Dep. Heuler Cruvinel,PP,GO,governo,Dep. Heuler Cruvinel (PP/GO),3
11,160598,Dep. Flávia Morais,PDT,GO,oposição,Dep. Flávia Morais (PDT/GO),1
11,160601,Dep. Pr. Marco Feliciano,PODE,SP,governo,Dep. Pr. Marco Feliciano (PODE/SP),1
11,160636,Dep. Wilson Filho,PTB,PB,governo,Dep. Wilson Filho (PTB/PB),1
11,160637,Dep. Ronaldo Fonseca,PODE,DF,governo,Dep. Ronaldo Fonseca (PODE/DF),1
11,160646,Dep. Fernando Francischini,PSL,,governo,Dep. Fernando Francischini (PSL/NA),1.6666666666666665
11,160651,Dep. Rogério Peninha Mendonça,MDB,SC,governo,Dep. Rogério Peninha Mendonça (MDB/SC),3
11,160663,Dep. Leopoldo Meyer,PSB,PR,oposição,Dep. Leopoldo Meyer (PSB/PR),1
11,162332,Dep. Luiz Nishimori,PL,PR,governo,Dep. Luiz Nishimori (PL/PR),1
11,164359,Dep. Delegado Waldir,PSL,GO,governo,Dep. Delegado Waldir (PSL/GO),5.5
11,166401,Dep. Nilson Leitão,PSDB,MT,governo,Dep. Nilson Leitão (PSDB/MT),1
11,167614,Dep. Severino Ninho,PSB,PE,oposição,Dep. Severino Ninho (PSB/PE),1
11,177282,Dep. Subtenente Gonzaga,PDT,MG,oposição,Dep. Subtenente Gonzaga (PDT/MG),1.6666666666666665
11,178825,Dep. Leo De Brito,PT,,oposição,Dep. Leo De Brito (PT/NA),1
11,178826,Dep. Major Olimpio,PSL,SP,governo,Dep. Major Olimpio (PSL/SP),4
11,178829,Dep. Capitão Augusto,PL,SP,governo,Dep. Capitão Augusto (PL/SP),2
11,178852,Dep. Marcos Reategui,PSD,AP,governo,Dep. Marcos Reategui (PSD/AP),1
11,178864,Dep. Adail Carneiro,PODE,CE,governo,Dep. Adail Carneiro (PODE/CE),1
11,178865,Dep. Cabo Sabino,AVANTE,CE,governo,Dep. Cabo Sabino (AVANTE/CE),1
11,178869,Dep. Vitor Valim,PROS,CE,governo,Dep. Vitor Valim (PROS/CE),1
11,178881,Dep. Aluisio Mendes,PODE,MA,governo,Dep. Aluisio Mendes (PODE/MA),1
11,178898,Dep. Tenente Lúcio,PR,MG,governo,Dep. Tenente Lúcio (PR/MG),1
11,178900,Dep. Carlos Marun,MDB,,governo,Dep. Carlos Marun (MDB/NA),1
11,178908,Dep. Delegado Éder Mauro,PSD,PA,governo,Dep. Delegado Éder Mauro (PSD/PA),1
11,178913,Dep. Veneziano Vital Do Rêgo,PSB,PB,oposição,Dep. Veneziano Vital Do Rêgo (PSB/PB),1
11,178924,Dep. Capitão Fábio Abreu,PL,,governo,Dep. Capitão Fábio Abreu (PL/NA),3
11,178948,Dep. Beto Rosado,PP,RN,governo,Dep. Beto Rosado (PP/RN),2
11,178953,Dep. Expedito Netto,PSD,RO,governo,Dep. Expedito Netto (PSD/RO),2
11,178954,Dep. Lucio Mosquini,MDB,RO,governo,Dep. Lucio Mosquini (MDB/RO),2
11,178963,Dep. Covatti Filho,PP,,governo,Dep. Covatti Filho (PP/NA),1
11,178964,Dep. Heitor Schuch,PSB,RS,oposição,Dep. Heitor Schuch (PSB/RS),2
11,178993,Dep. Carlos Henrique Gaguim,DEM,TO,governo,Dep. Carlos Henrique Gaguim (DEM/TO),1
11,179587,Dep. Major Vitor Hugo,PSL,GO,governo,Dep. Major Vitor Hugo (PSL/GO),2
11,185500,Dep. Deoclides Macedo,PDT,MA,oposição,Dep. Deoclides Macedo (PDT/MA),1
11,194260,Dep. Nivaldo Albuquerque,PTB,AL,governo,Dep. Nivaldo Albuquerque (PTB/AL),1
11,195826,Dep. Marcelo Delaroli,PR,RJ,governo,Dep. Marcelo Delaroli (PR/RJ),1
11,204355,Dep. Da Vitoria,CIDADANIA,ES,governo,Dep. Da Vitoria (CIDADANIA/ES),1
11,204356,Dep. Amaro Neto,PRB,ES,governo,Dep. Amaro Neto (PRB/ES),1
11,204359,Dep. Léo Moraes,PODE,RO,governo,Dep. Léo Moraes (PODE/RO),1
11,204368,Dep. Fabio Schiochet,PSL,SC,governo,Dep. Fabio Schiochet (PSL/SC),1
11,204388,Dep. Bibo Nunes,PSL,RS,governo,Dep. Bibo Nunes (PSL/RS),2
11,204391,Dep. José Nelto,PODE,GO,governo,Dep. José Nelto (PODE/GO),1
11,204416,Dep. Sanderson,PSL,RS,governo,Dep. Sanderson (PSL/RS),7
11,204418,Dep. Luizão Goulart,PRB,PR,governo,Dep. Luizão Goulart (PRB/PR),1
11,204420,Dep. Julian Lemos,PSL,PB,governo,Dep. Julian Lemos (PSL/PB),1
11,204421,Dep. Edna Henrique,PSDB,PB,governo,Dep. Edna Henrique (PSDB/PB),1
11,204441,Dep. Otoni De Paula,PSC,RJ,governo,Dep. Otoni De Paula (PSC/RJ),1
11,204442,Dep. Gurgel,PSL,RJ,governo,Dep. Gurgel (PSL/RJ),1
11,204456,Dep. Gutemberg Reis,MDB,RJ,governo,Dep. Gutemberg Reis (MDB/RJ),1.5
11,204472,Dep. José Medeiros,PODE,MT,governo,Dep. José Medeiros (PODE/MT),1
11,204511,Dep. David Soares,DEM,SP,governo,Dep. David Soares (DEM/SP),1
11,204512,Dep. Delegado Marcelo Freitas,PSL,MG,governo,Dep. Delegado Marcelo Freitas (PSL/MG),1
11,204529,Dep. Policial Katia Sastre,PL,SP,governo,Dep. Policial Katia Sastre (PL/SP),1
11,204531,Dep. Guilherme Derrite,PP,,governo,Dep. Guilherme Derrite (PP/NA),1
11,204548,Dep. Heitor Freire,PSL,CE,governo,Dep. Heitor Freire (PSL/CE),2
11,204550,Dep. Júnior Mano,PL,CE,governo,Dep. Júnior Mano (PL/CE),1
11,204576,Dep. João Roma,PRB,BA,governo,Dep. João Roma (PRB/BA),1
11,66179,Dep. Norma Ayub,DEM,ES,governo,Dep. Norma Ayub (DEM/ES),1
11,66828,Dep. Fausto Pinato,PP,SP,governo,Dep. Fausto Pinato (PP/SP),1
11,73434,Dep. Arnaldo Faria De Sá,PP,SP,governo,Dep. Arnaldo Faria De Sá (PP/SP),2
11,73486,Dep. Pompeo De Mattos,PDT,RS,oposição,Dep. Pompeo De Mattos (PDT/RS),3
11,73579,Dep. Alberto Fraga,DEM,DF,governo,Dep. Alberto Fraga (DEM/DF),9.5
11,73655,Dep. Augusto Carvalho,SOLIDARIEDADE,DF,governo,Dep. Augusto Carvalho (SOLIDARIEDADE/DF),1
11,73943,Dep. Perpétua Almeida,PCdoB,AC,oposição,Dep. Perpétua Almeida (PCdoB/AC),1
11,74040,Dep. Benjamin Maranhão,MDB,PB,governo,Dep. Benjamin Maranhão (MDB/PB),1
11,74044,Dep. Wilson Santiago,PTB,PB,governo,Dep. Wilson Santiago (PTB/PB),1
11,74048,Dep. Raul Jungmann,PPS,PE,governo,Dep. Raul Jungmann (PPS/PE),0.6666666666666666
11,74161,Dep. Reginaldo Lopes,PT,MG,oposição,Dep. Reginaldo Lopes (PT/MG),1
11,74253,Dep. Julio Lopes,PP,RJ,governo,Dep. Julio Lopes (PP/RJ),0.5
11,74305,Dep. Roberto Pessoa,PSDB,CE,governo,Dep. Roberto Pessoa (PSDB/CE),1
11,74366,Dep. João Campos,PRB,GO,governo,Dep. João Campos (PRB/GO),1
11,74399,Dep. Onyx Lorenzoni,DEM,,governo,Dep. Onyx Lorenzoni (DEM/NA),6
11,74419,Dep. Gonzaga Patriota,PSB,PE,oposição,Dep. Gonzaga Patriota (PSB/PE),1
11,74585,Dep. Lincoln Portela,PL,MG,governo,Dep. Lincoln Portela (PL/MG),5
11,74650,Dep. Bonifácio De Andrada,DEM,MG,governo,Dep. Bonifácio De Andrada (DEM/MG),1
11,74847,Dep. Jair Bolsonaro,PSL,,governo,Dep. Jair Bolsonaro (PSL/NA),1.6666666666666665
11,76874,Dep. Marcelo Freixo,PSOL,RJ,oposição,Dep. Marcelo Freixo (PSOL/RJ),1
11,92346,Dep. Eduardo Bolsonaro,PSL,SP,governo,Dep. Eduardo Bolsonaro (PSL/SP),4.666666666666667
11,73588,Dep. Mauro Benevides,MDB,CE,governo,Dep. Mauro Benevides (MDB/CE),0.5
11,141516,Dep. Paulo Abi-Ackel,PSDB,MG,governo,Dep. Paulo Abi-Ackel (PSDB/MG),0.5
12,101309,Dep. Davidson Magalhães,PCdoB,BA,oposição,Dep. Davidson Magalhães (PCdoB/BA),1
12,133439,Dep. André Figueiredo,PDT,CE,oposição,Dep. André Figueiredo (PDT/CE),1
12,134812,Dep. Edmilson Rodrigues,PSOL,PA,oposição,Dep. Edmilson Rodrigues (PSOL/PA),1.5
12,141478,Dep. Laerte Bessa,PR,DF,governo,Dep. Laerte Bessa (PR/DF),1
12,160511,Dep. Alessandro Molon,PSB,RJ,oposição,Dep. Alessandro Molon (PSB/RJ),2
12,160637,Dep. Ronaldo Fonseca,PODE,DF,governo,Dep. Ronaldo Fonseca (PODE/DF),1
12,160653,Dep. Roberto De Lucena,PODE,SP,governo,Dep. Roberto De Lucena (PODE/SP),5
12,177282,Dep. Subtenente Gonzaga,PDT,MG,oposição,Dep. Subtenente Gonzaga (PDT/MG),1
12,178826,Dep. Major Olimpio,PSL,SP,governo,Dep. Major Olimpio (PSL/SP),3
12,178829,Dep. Capitão Augusto,PL,SP,governo,Dep. Capitão Augusto (PL/SP),1
12,178864,Dep. Adail Carneiro,PODE,CE,governo,Dep. Adail Carneiro (PODE/CE),1
12,178865,Dep. Cabo Sabino,AVANTE,CE,governo,Dep. Cabo Sabino (AVANTE/CE),1
12,178866,Dep. Luizianne Lins,PT,CE,oposição,Dep. Luizianne Lins (PT/CE),2
12,178944,Dep. Roberto Sales,DEM,RJ,governo,Dep. Roberto Sales (DEM/RJ),1
12,178964,Dep. Heitor Schuch,PSB,RS,oposição,Dep. Heitor Schuch (PSB/RS),4
12,64960,Dep. Maria Helena,MDB,RR,governo,Dep. Maria Helena (MDB/RR),1
12,73433,Dep. Arlindo Chinaglia,PT,SP,oposição,Dep. Arlindo Chinaglia (PT/SP),1
12,73434,Dep. Arnaldo Faria De Sá,PP,SP,governo,Dep. Arnaldo Faria De Sá (PP/SP),23
12,73531,Dep. Ivan Valente,PSOL,SP,oposição,Dep. Ivan Valente (PSOL/SP),2.5
12,74161,Dep. Reginaldo Lopes,PT,MG,oposição,Dep. Reginaldo Lopes (PT/MG),2
12,74253,Dep. Julio Lopes,PP,RJ,governo,Dep. Julio Lopes (PP/RJ),1
12,74275,Dep. José Mentor,PT,SP,oposição,Dep. José Mentor (PT/SP),1
12,74366,Dep. João Campos,PRB,GO,governo,Dep. João Campos (PRB/GO),1
12,74378,Dep. Assis Do Couto,PDT,PR,oposição,Dep. Assis Do Couto (PDT/PR),1
12,74399,Dep. Onyx Lorenzoni,DEM,,governo,Dep. Onyx Lorenzoni (DEM/NA),1
15,160655,Dep. Ricardo Izar,PP,SP,governo,Dep. Ricardo Izar (PP/SP),1
17,160511,Dep. Alessandro Molon,PSB,RJ,oposição,Dep. Alessandro Molon (PSB/RJ),1
17,178986,Dep. Nilto Tatto,PT,SP,oposição,Dep. Nilto Tatto (PT/SP),3
17,204386,Dep. Jose Mario Schreiner,DEM,GO,governo,Dep. Jose Mario Schreiner (DEM/GO),1
20,141391,Dep. Arnaldo Jardim,CIDADANIA,SP,governo,Dep. Arnaldo Jardim (CIDADANIA/SP),1
20,160515,Dep. Ronaldo Benedet,MDB,SC,governo,Dep. Ronaldo Benedet (MDB/SC),1
20,160528,Dep. Danilo Cabral,PSB,PE,oposição,Dep. Danilo Cabral (PSB/PE),1
20,160543,Dep. Andre Moura,PSC,,governo,Dep. Andre Moura (PSC/NA),1
20,160575,Dep. Erika Kokay,PT,DF,oposição,Dep. Erika Kokay (PT/DF),2
20,160611,Dep. Toninho Pinheiro,PP,MG,governo,Dep. Toninho Pinheiro (PP/MG),2
20,160619,Dep. José Nunes,PSD,BA,governo,Dep. José Nunes (PSD/BA),3
20,160620,Dep. Washington Reis,MDB,,governo,Dep. Washington Reis (MDB/NA),1
20,160621,Dep. Sandro Alex,PSD,,governo,Dep. Sandro Alex (PSD/NA),1
20,171619,Dep. Margarida Salomão,PT,MG,oposição,Dep. Margarida Salomão (PT/MG),2
20,178978,Dep. Flavinho,PSC,SP,governo,Dep. Flavinho (PSC/SP),1
20,195997,Dep. Pollyana Gama,PPS,SP,governo,Dep. Pollyana Gama (PPS/SP),1
20,204537,Dep. Enrico Misasi,PV,SP,governo,Dep. Enrico Misasi (PV/SP),1
20,73673,Dep. Pedro Wilson,PT,GO,oposição,Dep. Pedro Wilson (PT/GO),0.6666666666666666
20,74285,Dep. Carlos Abicalil,PT,MT,oposição,Dep. Carlos Abicalil (PT/MT),1.6666666666666665
20,74398,Dep. Maria Do Rosário,PT,RS,oposição,Dep. Maria Do Rosário (PT/RS),1
20,74439,Dep. Wolney Queiroz,PDT,PE,oposição,Dep. Wolney Queiroz (PDT/PE),1
20,74641,Dep. Severiano Alves,PMDB,BA,governo,Dep. Severiano Alves (PMDB/BA),1
20,74655,Dep. Eduardo Barbosa,PSDB,MG,governo,Dep. Eduardo Barbosa (PSDB/MG),1
20,74688,Dep. Luiz Sérgio,PT,RJ,oposição,Dep. Luiz Sérgio (PT/RJ),1
20,74856,Dep. Laura Carneiro,DEM,RJ,governo,Dep. Laura Carneiro (DEM/RJ),0.5
20,141468,Dep. Iran Barbosa,PT,SE,oposição,Dep. Iran Barbosa (PT/SE),0.6666666666666666
20,164360,Dep. Carmen Zanotto,CIDADANIA,SC,governo,Dep. Carmen Zanotto (CIDADANIA/SC),0.5
22,160567,Dep. Nelson Marchezan Junior,PSDB,,governo,Dep. Nelson Marchezan Junior (PSDB/-),1
22,160639,Dep. Professora Dorinha Seabra Rezende,DEM,TO,governo,Dep. Professora Dorinha Seabra Rezende (DEM/-),1
23,148134,Dep. Professor Victório Galli,PSL,MT,governo,Dep. Professor Victório Galli (PSL/MT),1
23,160563,Dep. Onofre Santo Agostini,PSD,SC,governo,Dep. Onofre Santo Agostini (PSD/SC),1
23,160655,Dep. Ricardo Izar,PP,SP,governo,Dep. Ricardo Izar (PP/SP),1
23,73441,Dep. Celso Russomanno,PRB,SP,governo,Dep. Celso Russomanno (PRB/SP),1
23,73768,Dep. Dilceu Sperafico,PP,PR,governo,Dep. Dilceu Sperafico (PP/PR),1
23,73793,Dep. Edinho Bez,MDB,SC,governo,Dep. Edinho Bez (MDB/SC),1
24,114941,Dep. Josi Nunes,PROS,TO,governo,Dep. Josi Nunes (PROS/TO),1
24,141490,Dep. Manoel Junior,MDB,,governo,Dep. Manoel Junior (MDB/NA),1
24,141517,Dep. Paulo Henrique Lustosa,PP,CE,governo,Dep. Paulo Henrique Lustosa (PP/CE),1
24,160514,Dep. Dr. Grilo,SD,MG,governo,Dep. Dr. Grilo (SD/MG),1
24,160628,Dep. Luciana Santos,PCdoB,,oposição,Dep. Luciana Santos (PCdoB/NA),1
24,160672,Dep. Jean Wyllys,PSOL,,oposição,Dep. Jean Wyllys (PSOL/NA),1
24,204425,Dep. Silvio Costa Filho,PRB,PE,governo,Dep. Silvio Costa Filho (PRB/PE),1
24,204523,Dep. Lucas Gonzalez,NOVO,MG,governo,Dep. Lucas Gonzalez (NOVO/MG),1
24,73579,Dep. Alberto Fraga,DEM,DF,governo,Dep. Alberto Fraga (DEM/DF),1
26,160511,Dep. Alessandro Molon,PSB,RJ,oposição,Dep. Alessandro Molon (PSB/RJ),1
26,160598,Dep. Flávia Morais,PDT,GO,oposição,Dep. Flávia Morais (PDT/GO),1
26,160653,Dep. Roberto De Lucena,PODE,SP,governo,Dep. Roberto De Lucena (PODE/SP),1
26,178881,Dep. Aluisio Mendes,PODE,MA,governo,Dep. Aluisio Mendes (PODE/MA),1
26,178915,Dep. Betinho Gomes,PSDB,PE,governo,Dep. Betinho Gomes (PSDB/PE),2
26,204377,Dep. Paula Belmonte,CIDADANIA,DF,governo,Dep. Paula Belmonte (CIDADANIA/DF),1
26,204488,Dep. Célio Studart,PV,CE,governo,Dep. Célio Studart (PV/CE),1
26,204526,Dep. Luiz Philippe De Orleans e Bragança,PSL,SP,governo,Dep. Luiz Philippe De Orleans e Bragança (PSL/SP),4
26,204530,Dep. Rodrigo Agostinho,PSB,SP,oposição,Dep. Rodrigo Agostinho (PSB/SP),1
26,204536,Dep. Kim Kataguiri,DEM,SP,governo,Dep. Kim Kataguiri (DEM/SP),1
26,74585,Dep. Lincoln Portela,PL,MG,governo,Dep. Lincoln Portela (PL/MG),1
26,74665,Dep. Jaime Martins,PROS,MG,governo,Dep. Jaime Martins (PROS/MG),1
26,88950,Dep. Rodrigo Garcia,DEM,,governo,Dep. Rodrigo Garcia (DEM/NA),2
27,107283,Dep. Gleisi Hoffmann,PT,PR,oposição,Dep. Gleisi Hoffmann (PT/PR),23.726190476190474
27,108338,Dep. Jaqueline Cassol,PP,RO,governo,Dep. Jaqueline Cassol (PP/RO),1
27,116379,Dep. Darci De Matos,PSD,SC,governo,Dep. Darci De Matos (PSD/SC),2
27,122158,Dep. Pedro Paulo,DEM,RJ,governo,Dep. Pedro Paulo (DEM/RJ),2
27,133439,Dep. André Figueiredo,PDT,CE,oposição,Dep. André Figueiredo (PDT/CE),9
27,133968,Dep. Paulo Ramos,PDT,RJ,oposição,Dep. Paulo Ramos (PDT/RJ),6.4
27,134812,Dep. Edmilson Rodrigues,PSOL,PA,oposição,Dep. Edmilson Rodrigues (PSOL/PA),3.6000000000000005
27,136811,Dep. Afonso Hamm,PP,RS,governo,Dep. Afonso Hamm (PP/RS),1
27,141405,Dep. Celso Maldaner,MDB,SC,governo,Dep. Celso Maldaner (MDB/SC),0.5
27,141408,Dep. Cleber Verde,PRB,MA,governo,Dep. Cleber Verde (PRB/MA),4
27,141411,Dep. Dagoberto Nogueira,PDT,MS,oposição,Dep. Dagoberto Nogueira (PDT/MS),4
27,141421,Dep. Eduardo Da Fonte,PP,PE,governo,Dep. Eduardo Da Fonte (PP/PE),2
27,141427,Dep. Fábio Ramalho,MDB,MG,governo,Dep. Fábio Ramalho (MDB/MG),2
27,141439,Dep. Chico D'angelo,PDT,RJ,oposição,Dep. Chico D'angelo (PDT/RJ),1
27,141450,Dep. Hugo Leal,PSD,RJ,governo,Dep. Hugo Leal (PSD/RJ),1
27,141470,Dep. José Guimarães,PT,CE,oposição,Dep. José Guimarães (PT/CE),23.726190476190474
27,141488,Dep. Paulo Teixeira,PT,SP,oposição,Dep. Paulo Teixeira (PT/SP),23.226190476190474
27,141513,Dep. Bilac Pinto,DEM,MG,governo,Dep. Bilac Pinto (DEM/MG),1
27,141516,Dep. Paulo Abi-Ackel,PSDB,MG,governo,Dep. Paulo Abi-Ackel (PSDB/MG),1
27,141518,Dep. Paulo Pereira Da Silva,SOLIDARIEDADE,SP,governo,Dep. Paulo Pereira Da Silva (SOLIDARIEDADE/SP),2.5
27,141552,Dep. Valtenir Pereira,MDB,MT,governo,Dep. Valtenir Pereira (MDB/MT),5
27,141555,Dep. Vinicius Carvalho,PRB,SP,governo,Dep. Vinicius Carvalho (PRB/SP),3.5
27,143084,Dep. Tiago Dimas,SOLIDARIEDADE,TO,governo,Dep. Tiago Dimas (SOLIDARIEDADE/TO),2
27,143632,Dep. Domingos Neto,PSD,CE,governo,Dep. Domingos Neto (PSD/CE),2
27,146788,Dep. Marcelo Aro,PP,MG,governo,Dep. Marcelo Aro (PP/MG),2
27,152605,Dep. Glauber Braga,PSOL,RJ,oposição,Dep. Glauber Braga (PSOL/RJ),3.6
27,156190,Dep. Marcel Van Hattem,NOVO,RS,governo,Dep. Marcel Van Hattem (NOVO/RS),3.75
27,157130,Dep. Túlio Gadêlha,PDT,PE,oposição,Dep. Túlio Gadêlha (PDT/PE),1
27,160511,Dep. Alessandro Molon,PSB,RJ,oposição,Dep. Alessandro Molon (PSB/RJ),0.5
27,160512,Dep. Aureo Ribeiro,SOLIDARIEDADE,RJ,governo,Dep. Aureo Ribeiro (SOLIDARIEDADE/RJ),0.5
27,160518,Dep. Weliton Prado,PROS,MG,governo,Dep. Weliton Prado (PROS/MG),1
27,160527,Dep. Aguinaldo Ribeiro,PP,PB,governo,Dep. Aguinaldo Ribeiro (PP/PB),1
27,160528,Dep. Danilo Cabral,PSB,PE,oposição,Dep. Danilo Cabral (PSB/PE),3.875
27,160556,Dep. Padre João,PT,MG,oposição,Dep. Padre João (PT/MG),2
27,160570,Dep. Jerônimo Goergen,PP,RS,governo,Dep. Jerônimo Goergen (PP/RS),8
27,160575,Dep. Erika Kokay,PT,DF,oposição,Dep. Erika Kokay (PT/DF),11
27,160588,Dep. Diego Andrade,PSD,MG,governo,Dep. Diego Andrade (PSD/MG),1
27,160604,Dep. Pedro Uczai,PT,SC,oposição,Dep. Pedro Uczai (PT/SC),18.892857142857142
27,160632,Dep. Zé Silva,SOLIDARIEDADE,MG,governo,Dep. Zé Silva (SOLIDARIEDADE/MG),1
27,160639,Dep. Professora Dorinha Seabra Rezende,DEM,TO,governo,Dep. Professora Dorinha Seabra Rezende (DEM/TO),5
27,160641,Dep. Professora Marcivania,PCdoB,AP,oposição,Dep. Professora Marcivania (PCdoB/AP),4.375
27,160642,Dep. Pastor Eurico,PATRIOTA,PE,governo,Dep. Pastor Eurico (PATRIOTA/PE),3.833333333333333
27,160653,Dep. Roberto De Lucena,PODE,SP,governo,Dep. Roberto De Lucena (PODE/SP),1
27,160655,Dep. Ricardo Izar,PP,SP,governo,Dep. Ricardo Izar (PP/SP),1
27,160758,Dep. Domingos Sávio,PSDB,MG,governo,Dep. Domingos Sávio (PSDB/MG),1
27,164359,Dep. Delegado Waldir,PSL,GO,governo,Dep. Delegado Waldir (PSL/GO),2
