id_leggo,id_autor,nome,partido,uf,bancada,nome_eleitoral,node_size
30,204366,Dep. Rodrigo Coelho,PSB,SC,oposição,Dep. Rodrigo Coelho (PSB/SC),1
30,204497,Dep. Júnior Ferrari,PSD,PA,governo,Dep. Júnior Ferrari (PSD/PA),1
30,204506,Dep. Marcos Pereira,PRB,SP,governo,Dep. Marcos Pereira (PRB/SP),1
30,76874,Dep. Marcelo Freixo,PSOL,RJ,oposição,Dep. Marcelo Freixo (PSOL/RJ),1
31,160570,Dep. Jerônimo Goergen,PP,RS,governo,Dep. Jerônimo Goergen (PP/RS),0.5
31,160653,Dep. Roberto De Lucena,PODE,SP,governo,Dep. Roberto De Lucena (PODE/SP),1
31,178989,Dep. Renata Abreu,PODE,SP,governo,Dep. Renata Abreu (PODE/SP),0.5
31,204366,Dep. Rodrigo Coelho,PSB,SC,oposição,Dep. Rodrigo Coelho (PSB/SC),1
31,204374,Dep. Bia Kicis,PSL,DF,governo,Dep. Bia Kicis (PSL/DF),2
31,204506,Dep. Marcos Pereira,PRB,SP,governo,Dep. Marcos Pereira (PRB/SP),1
31,204526,Dep. Luiz Philippe De Orleans e Bragança,PSL,SP,governo,Dep. Luiz Philippe De Orleans e Bragança (PSL/SP),1
31,204543,Dep. Luiz Flávio Gomes,PSB,SP,oposição,Dep. Luiz Flávio Gomes (PSB/SP),1
31,76874,Dep. Marcelo Freixo,PSOL,RJ,oposição,Dep. Marcelo Freixo (PSOL/RJ),1
31,5979,Sen. Leila Barros,PSB,DF,oposição,Sen. Leila Barros (PSB/DF),6
31,204536,Dep. Kim Kataguiri,DEM,SP,governo,Dep. Kim Kataguiri (DEM/SP),0.5
31,204391,Dep. José Nelto,PODE,GO,governo,Dep. José Nelto (PODE/GO),0.5
32,109429,Dep. Benes Leocádio,PRB,RN,governo,Dep. Benes Leocádio (PRB/RN),6
32,133439,Dep. André Figueiredo,PDT,CE,oposição,Dep. André Figueiredo (PDT/CE),4
32,134812,Dep. Edmilson Rodrigues,PSOL,PA,oposição,Dep. Edmilson Rodrigues (PSOL/PA),26
32,152605,Dep. Glauber Braga,PSOL,RJ,oposição,Dep. Glauber Braga (PSOL/RJ),29
32,160528,Dep. Danilo Cabral,PSB,PE,oposição,Dep. Danilo Cabral (PSB/PE),12
32,160538,Dep. Bohn Gass,PT,RS,oposição,Dep. Bohn Gass (PT/RS),11
32,160556,Dep. Padre João,PT,MG,oposição,Dep. Padre João (PT/MG),24
32,160568,Dep. Rogério Carvalho,PT,SE,oposição,Dep. Rogério Carvalho (PT/SE),10
32,171619,Dep. Margarida Salomão,PT,MG,oposição,Dep. Margarida Salomão (PT/MG),7
32,178826,Dep. Major Olimpio,PSL,SP,governo,Dep. Major Olimpio (PSL/SP),8
32,178884,Dep. Hildo Rocha,MDB,MA,governo,Dep. Hildo Rocha (MDB/MA),29
32,178887,Dep. Rubens Pereira Júnior,PCdoB,,oposição,Dep. Rubens Pereira Júnior (PCdoB/NA),5
32,178947,Dep. Sóstenes Cavalcante,DEM,RJ,governo,Dep. Sóstenes Cavalcante (DEM/RJ),26
32,178970,Dep. João Daniel,PT,SE,oposição,Dep. João Daniel (PT/SE),9
32,178986,Dep. Nilto Tatto,PT,SP,oposição,Dep. Nilto Tatto (PT/SP),37
32,178987,Dep. Orlando Silva,PCdoB,SP,oposição,Dep. Orlando Silva (PCdoB/SP),4
32,178990,Dep. Samuel Moreira,PSDB,SP,governo,Dep. Samuel Moreira (PSDB/SP),14
32,204365,Dep. Gilson Marques,NOVO,SC,governo,Dep. Gilson Marques (NOVO/SC),2
32,204371,Dep. Felipe Rigoni,PSB,ES,oposição,Dep. Felipe Rigoni (PSB/ES),9
32,204391,Dep. José Nelto,PODE,GO,governo,Dep. José Nelto (PODE/GO),3
32,204394,Dep. Gervásio Maia,PSB,PB,oposição,Dep. Gervásio Maia (PSB/PB),2
32,204419,Dep. Glaustin Fokus,PSC,GO,governo,Dep. Glaustin Fokus (PSC/GO),2
32,204449,Dep. Nelson Barbudo,PSL,MT,governo,Dep. Nelson Barbudo (PSL/MT),51
32,204453,Dep. Natália Bonavides,PT,RN,oposição,Dep. Natália Bonavides (PT/RN),3
32,204464,Dep. Talíria Petrone,PSOL,RJ,oposição,Dep. Talíria Petrone (PSOL/RJ),14
32,204500,Dep. Eduardo Costa,PTB,PA,governo,Dep. Eduardo Costa (PTB/PA),25
32,204555,Dep. José Ricardo,PT,AM,oposição,Dep. José Ricardo (PT/AM),36
32,204575,Dep. Gil Cutrim,PDT,MA,oposição,Dep. Gil Cutrim (PDT/MA),3
32,4931,Dep. Izalci Lucas,PSDB,DF,governo,Dep. Izalci Lucas (PSDB/DF),52
32,73460,Dep. Gustavo Fruet,PDT,PR,oposição,Dep. Gustavo Fruet (PDT/PR),2
32,73943,Dep. Perpétua Almeida,PCdoB,AC,oposição,Dep. Perpétua Almeida (PCdoB/AC),7
32,74057,Dep. Alice Portugal,PCdoB,BA,oposição,Dep. Alice Portugal (PCdoB/BA),5
32,74400,Dep. Paulo Pimenta,PT,RS,oposição,Dep. Paulo Pimenta (PT/RS),36
32,74848,Dep. Jandira Feghali,PCdoB,RJ,oposição,Dep. Jandira Feghali (PCdoB/RJ),5
32,81055,Dep. Márcio Jerry,PCdoB,MA,oposição,Dep. Márcio Jerry (PCdoB/MA),5
32,141470,Sen. José Guimarães,PT,CE,oposição,Sen. José Guimarães (PT/CE),3
32,160508,Sen. Afonso Florence,PT,BA,oposição,Sen. Afonso Florence (PT/BA),2
32,160604,Sen. Pedro Uczai,PT,SC,oposição,Sen. Pedro Uczai (PT/SC),1
32,178977,Sen. Eduardo Cury,PSDB,SP,governo,Sen. Eduardo Cury (PSDB/SP),1
32,204504,Sen. Cezinha de Madureira,PSD,SP,governo,Sen. Cezinha de Madureira (PSD/SP),1
32,204508,Sen. Igor Timo,PODE,MG,governo,Sen. Igor Timo (PODE/MG),3
32,3396,Sen. Tasso Jereissati,PSDB,CE,governo,Sen. Tasso Jereissati (PSDB/CE),9
32,4770,Sen. Izalci Lucas,PSDB,DF,governo,Sen. Izalci Lucas (PSDB/DF),52
32,5352,Sen. Rogério Carvalho,PT,SE,oposição,Sen. Rogério Carvalho (PT/SE),10
32,5411,Sen. Weverton,PDT,MA,oposição,Sen. Weverton (PDT/MA),3
32,5666,Sen. Major Olimpio,PSL,SP,governo,Sen. Major Olimpio (PSL/SP),9
33,132504,Dep. Enio Verri,PT,,oposição,Dep. Enio Verri (PT/-),2.1666666666666665
33,141398,Dep. Carlos Zarattini,PT,SP,oposição,Dep. Carlos Zarattini (PT/-),1
33,141422,Dep. Efraim Filho,DEM,,governo,Dep. Efraim Filho (DEM/-),0.75
33,178922,Dep. Tadeu Alencar,PSB,PE,oposição,Dep. Tadeu Alencar (PSB/-),0.75
33,178975,Dep. Baleia Rossi,MDB,SP,governo,Dep. Baleia Rossi (MDB/-),0.75
33,204371,Dep. Felipe Rigoni,PSB,ES,oposição,Dep. Felipe Rigoni (PSB/-),2.1666666666666665
33,204388,Dep. Bibo Nunes,PSL,RS,governo,Dep. Bibo Nunes (PSL/-),0.75
33,204429,Dep. João H. Campos,PSB,PE,oposição,Dep. João H. Campos (PSB/-),0.75
33,204534,Dep. Tabata Amaral,PDT,SP,oposição,Dep. Tabata Amaral (PDT/-),2.1666666666666665
33,204544,Dep. Alexandre Frota,PSL,SP,governo,Dep. Alexandre Frota (PSL/-),0.75
34,160512,Dep. Aureo Ribeiro,SOLIDARIEDADE,RJ,governo,Dep. Aureo Ribeiro (SOLIDARIEDADE/RJ),1
34,160587,Dep. Fábio Trad,PSD,MS,governo,Dep. Fábio Trad (PSD/MS),1
34,164359,Dep. Delegado Waldir,PSL,GO,governo,Dep. Delegado Waldir (PSL/GO),1
34,178832,Dep. Leandre,PV,PR,governo,Dep. Leandre (PV/PR),1
34,204366,Dep. Rodrigo Coelho,PSB,SC,oposição,Dep. Rodrigo Coelho (PSB/SC),1
34,204497,Dep. Júnior Ferrari,PSD,PA,governo,Dep. Júnior Ferrari (PSD/PA),1
34,204506,Dep. Marcos Pereira,PRB,SP,governo,Dep. Marcos Pereira (PRB/SP),1
34,204527,Dep. Geninho Zuliani,DEM,SP,governo,Dep. Geninho Zuliani (DEM/SP),1
34,74554,Dep. José Rocha,PL,BA,governo,Dep. José Rocha (PL/BA),1
34,76874,Dep. Marcelo Freixo,PSOL,RJ,oposição,Dep. Marcelo Freixo (PSOL/RJ),1
35,160559,Dep. Alceu Moreira,MDB,,governo,Dep. Alceu Moreira (MDB/-),1
35,178871,Dep. Evair Vieira De Melo,PP,ES,governo,Dep. Evair Vieira De Melo (PP/-),4
35,178933,Dep. Sergio Souza,MDB,PR,governo,Dep. Sergio Souza (MDB/-),8
35,178963,Dep. Covatti Filho,PP,,governo,Dep. Covatti Filho (PP/-),1
35,204386,Dep. Jose Mario Schreiner,DEM,GO,governo,Dep. Jose Mario Schreiner (DEM/-),2
35,204395,Dep. Pedro Lupion,DEM,PR,governo,Dep. Pedro Lupion (DEM/-),4
35,204449,Dep. Nelson Barbudo,PSL,MT,governo,Dep. Nelson Barbudo (PSL/-),15
35,73483,Dep. Luis Carlos Heinze,PP,,governo,Dep. Luis Carlos Heinze (PP/-),5
35,1186,Sen. Luis Carlos Heinze,PP,RS,governo,Sen. Luis Carlos Heinze (PP/-),5
35,141470,Sen. José Guimarães,PT,CE,oposição,Sen. José Guimarães (PT/-),3
35,178986,Sen. Nilto Tatto,PT,SP,oposição,Sen. Nilto Tatto (PT/-),3
35,204530,Sen. Rodrigo Agostinho,PSB,SP,oposição,Sen. Rodrigo Agostinho (PSB/-),2
35,5718,Sen. Eliziane Gama,CIDADANIA,MA,governo,Sen. Eliziane Gama (CIDADANIA/-),1
36,160511,Dep. Alessandro Molon,PSB,RJ,oposição,Dep. Alessandro Molon (PSB/RJ),1.5
36,74210,Dep. Sarney Filho,PV,MA,governo,Dep. Sarney Filho (PV/MA),0.5
37,122974,Dep. Pedro Lucas Fernandes,PTB,MA,governo,Dep. Pedro Lucas Fernandes (PTB/MA),2
37,132504,Dep. Enio Verri,PT,,oposição,Dep. Enio Verri (PT/NA),2
37,133439,Dep. André Figueiredo,PDT,CE,oposição,Dep. André Figueiredo (PDT/CE),1
37,141518,Dep. Paulo Pereira Da Silva,SOLIDARIEDADE,SP,governo,Dep. Paulo Pereira Da Silva (SOLIDARIEDADE/SP),11
37,156190,Dep. Marcel Van Hattem,NOVO,RS,governo,Dep. Marcel Van Hattem (NOVO/RS),2
37,160510,Dep. Luis Tibé,AVANTE,MG,governo,Dep. Luis Tibé (AVANTE/MG),1
37,164359,Dep. Delegado Waldir,PSL,GO,governo,Dep. Delegado Waldir (PSL/GO),1
37,178854,Dep. Elmar Nascimento,DEM,BA,governo,Dep. Elmar Nascimento (DEM/BA),2
37,204358,Dep. Beto Pereira,PSDB,MS,governo,Dep. Beto Pereira (PSDB/MS),1
37,204503,Dep. Alexandre Padilha,PT,SP,oposição,Dep. Alexandre Padilha (PT/SP),2
37,73482,Dep. Henrique Fontana,PT,RS,oposição,Dep. Henrique Fontana (PT/RS),1
37,73486,Dep. Pompeo De Mattos,PDT,RS,oposição,Dep. Pompeo De Mattos (PDT/RS),1
37,74400,Dep. Paulo Pimenta,PT,RS,oposição,Dep. Paulo Pimenta (PT/RS),2
37,74478,Dep. Luciano Bivar,PSL,PE,governo,Dep. Luciano Bivar (PSL/PE),1
37,74693,Dep. Rodrigo Maia,DEM,RJ,governo,Dep. Rodrigo Maia (DEM/RJ),1
37,1173,Sen. Wellington Fagundes,PR,MT,governo,Sen. Wellington Fagundes (PR/MT),1
37,5422,Sen. Marcos Rogério,DEM,RO,governo,Sen. Marcos Rogério (DEM/RO),2
37,5533,Sen. Lasier Martins,PSD,RS,governo,Sen. Lasier Martins (PSD/RS),4
37,5718,Sen. Eliziane Gama,CIDADANIA,MA,governo,Sen. Eliziane Gama (CIDADANIA/MA),1
37,5924,Sen. Oriovisto Guimarães,PODEMOS,PR,governo,Sen. Oriovisto Guimarães (PODEMOS/PR),2
37,5953,Sen. Fabiano Contarato,REDE,ES,oposição,Sen. Fabiano Contarato (REDE/ES),1
37,5959,Sen. Styvenson Valentim,PODEMOS,RN,governo,Sen. Styvenson Valentim (PODEMOS/RN),1
37,5982,Sen. Alessandro Vieira,CIDADANIA,SE,governo,Sen. Alessandro Vieira (CIDADANIA/SE),1
37,739,Sen. Ciro Nogueira,PP,PI,governo,Sen. Ciro Nogueira (PP/PI),3
38,160653,Dep. Roberto De Lucena,PODE,SP,governo,Dep. Roberto De Lucena (PODE/SP),1
38,178881,Dep. Aluisio Mendes,PODE,MA,governo,Dep. Aluisio Mendes (PODE/MA),1
39,141523,Dep. Raul Henry,MDB,PE,governo,Dep. Raul Henry (MDB/PE),1
39,160592,Dep. Zeca Dirceu,PT,PR,oposição,Dep. Zeca Dirceu (PT/PR),0.8888888888888888
39,160604,Dep. Pedro Uczai,PT,SC,oposição,Dep. Pedro Uczai (PT/SC),3.888888888888889
39,160639,Dep. Professora Dorinha Seabra Rezende,DEM,TO,governo,Dep. Professora Dorinha Seabra Rezende (DEM/TO),8.5
39,171619,Dep. Margarida Salomão,PT,MG,oposição,Dep. Margarida Salomão (PT/MG),0.8888888888888888
39,178842,Dep. Jhc,PSB,AL,oposição,Dep. Jhc (PSB/AL),0.8333333333333333
39,178998,Dep. Raquel Muniz,PSD,MG,governo,Dep. Raquel Muniz (PSD/MG),1
39,198783,Dep. Emanuel Pinheiro Neto,PTB,MT,governo,Dep. Emanuel Pinheiro Neto (PTB/MT),0.8333333333333333
39,204371,Dep. Felipe Rigoni,PSB,ES,oposição,Dep. Felipe Rigoni (PSB/ES),2.3333333333333335
39,204375,Dep. Leda Sadala,AVANTE,AP,governo,Dep. Leda Sadala (AVANTE/AP),1
39,204429,Dep. João H. Campos,PSB,PE,oposição,Dep. João H. Campos (PSB/PE),0.8333333333333333
39,204433,Dep. Marcelo Calero,CIDADANIA,RJ,governo,Dep. Marcelo Calero (CIDADANIA/RJ),0.5
39,204453,Dep. Natália Bonavides,PT,RN,oposição,Dep. Natália Bonavides (PT/RN),0.8888888888888888
39,204459,Dep. Daniela Do Waguinho,MDB,RJ,governo,Dep. Daniela Do Waguinho (MDB/RJ),1
39,204467,Dep. Professora Rosa Neide,PT,MT,oposição,Dep. Professora Rosa Neide (PT/MT),3.888888888888889
39,204519,Dep. Tiago Mitraud,NOVO,MG,governo,Dep. Tiago Mitraud (NOVO/MG),2.333333333333333
39,69871,Dep. Bacelar,PODE,BA,governo,Dep. Bacelar (PODE/BA),1.5
39,74057,Dep. Alice Portugal,PCdoB,BA,oposição,Dep. Alice Portugal (PCdoB/BA),1
39,74160,Dep. Patrus Ananias,PT,MG,oposição,Dep. Patrus Ananias (PT/MG),0.8888888888888888
39,74161,Dep. Reginaldo Lopes,PT,MG,oposição,Dep. Reginaldo Lopes (PT/MG),0.8888888888888888
39,74398,Dep. Maria Do Rosário,PT,RS,oposição,Dep. Maria Do Rosário (PT/RS),0.8888888888888888
39,5531,Sen. Elmano Férrer,PODEMOS,PI,governo,Sen. Elmano Férrer (PODEMOS/PI),1
39,204501,Dep. Alencar Santana Braga,PT,SP,oposição,Dep. Alencar Santana Braga (PT/SP),0.8888888888888888
39,204528,Dep. Adriana Ventura,NOVO,SP,governo,Dep. Adriana Ventura (NOVO/SP),0.8333333333333333
39,204534,Dep. Tabata Amaral,PDT,SP,oposição,Dep. Tabata Amaral (PDT/SP),1.5
40,133439,Dep. André Figueiredo,PDT,CE,oposição,Dep. André Figueiredo (PDT/CE),4
40,133810,Dep. Marcelo Moraes,PTB,RS,governo,Dep. Marcelo Moraes (PTB/RS),1
40,141391,Dep. Arnaldo Jardim,CIDADANIA,SP,governo,Dep. Arnaldo Jardim (CIDADANIA/SP),5
40,141405,Dep. Celso Maldaner,MDB,SC,governo,Dep. Celso Maldaner (MDB/SC),1
40,141485,Dep. Luiz Carlos Busato,PTB,,governo,Dep. Luiz Carlos Busato (PTB/NA),1
40,141497,Dep. Márcio França,PSB,,oposição,Dep. Márcio França (PSB/NA),1
40,141508,Dep. Mauro Nazif,PSB,RO,oposição,Dep. Mauro Nazif (PSB/RO),1
40,141555,Dep. Vinicius Carvalho,PRB,SP,governo,Dep. Vinicius Carvalho (PRB/SP),2
40,151208,Dep. Laercio Oliveira,PP,SE,governo,Dep. Laercio Oliveira (PP/SE),6
40,160508,Dep. Afonso Florence,PT,BA,oposição,Dep. Afonso Florence (PT/BA),9
40,160531,Dep. Jhonatan De Jesus,PRB,RR,governo,Dep. Jhonatan De Jesus (PRB/RR),1
40,160587,Dep. Fábio Trad,PSD,MS,governo,Dep. Fábio Trad (PSD/MS),3
40,160635,Dep. Ruy Carneiro,PSDB,PB,governo,Dep. Ruy Carneiro (PSDB/PB),1
40,160638,Dep. Ângelo Agnolin,PDT,TO,oposição,Dep. Ângelo Agnolin (PDT/TO),1
40,160639,Dep. Professora Dorinha Seabra Rezende,DEM,TO,governo,Dep. Professora Dorinha Seabra Rezende (DEM/TO),6
40,160653,Dep. Roberto De Lucena,PODE,SP,governo,Dep. Roberto De Lucena (PODE/SP),1
40,160655,Dep. Ricardo Izar,PP,SP,governo,Dep. Ricardo Izar (PP/SP),1
40,160665,Dep. Augusto Coutinho,SOLIDARIEDADE,PE,governo,Dep. Augusto Coutinho (SOLIDARIEDADE/PE),7.8
40,160666,Dep. Félix Mendonça Júnior,PDT,BA,oposição,Dep. Félix Mendonça Júnior (PDT/BA),1
40,160672,Dep. Jean Wyllys,PSOL,,oposição,Dep. Jean Wyllys (PSOL/NA),1
40,164359,Dep. Delegado Waldir,PSL,GO,governo,Dep. Delegado Waldir (PSL/GO),3
40,178854,Dep. Elmar Nascimento,DEM,BA,governo,Dep. Elmar Nascimento (DEM/BA),1.8
40,178874,Dep. Sergio Vidigal,PDT,ES,oposição,Dep. Sergio Vidigal (PDT/ES),2
40,178884,Dep. Hildo Rocha,MDB,MA,governo,Dep. Hildo Rocha (MDB/MA),0.8
40,178910,Dep. Joaquim Passarinho,PSD,PA,governo,Dep. Joaquim Passarinho (PSD/PA),2
40,178916,Dep. Daniel Coelho,CIDADANIA,PE,governo,Dep. Daniel Coelho (CIDADANIA/PE),1
40,178992,Dep. Vitor Lippi,PSDB,SP,governo,Dep. Vitor Lippi (PSDB/SP),1
40,194260,Dep. Nivaldo Albuquerque,PTB,AL,governo,Dep. Nivaldo Albuquerque (PTB/AL),1
40,204364,Dep. Eli Borges,SOLIDARIEDADE,TO,governo,Dep. Eli Borges (SOLIDARIEDADE/TO),1
40,204365,Dep. Gilson Marques,NOVO,SC,governo,Dep. Gilson Marques (NOVO/SC),1
40,204371,Dep. Felipe Rigoni,PSB,ES,oposição,Dep. Felipe Rigoni (PSB/ES),1
40,204388,Dep. Bibo Nunes,PSL,RS,governo,Dep. Bibo Nunes (PSL/RS),6
40,204389,Dep. Elias Vaz,PSB,GO,oposição,Dep. Elias Vaz (PSB/GO),1
40,204396,Dep. Vermelho,PSD,PR,governo,Dep. Vermelho (PSD/PR),11
40,204398,Dep. Felipe Francischini,PSL,PR,governo,Dep. Felipe Francischini (PSL/PR),2
40,204418,Dep. Luizão Goulart,PRB,PR,governo,Dep. Luizão Goulart (PRB/PR),4
40,204427,Dep. Fernando Rodolfo,PL,PE,governo,Dep. Fernando Rodolfo (PL/PE),1
40,204429,Dep. João H. Campos,PSB,PE,oposição,Dep. João H. Campos (PSB/PE),1
40,204452,Dep. Márcio Labre,PSL,,governo,Dep. Márcio Labre (PSL/NA),1
40,204477,Dep. Felício Laterça,PSL,RJ,governo,Dep. Felício Laterça (PSL/RJ),5
40,204504,Dep. Cezinha De Madureira,PSD,SP,governo,Dep. Cezinha De Madureira (PSD/SP),1
40,204506,Dep. Marcos Pereira,PRB,SP,governo,Dep. Marcos Pereira (PRB/SP),2
40,204513,Dep. Guiga Peixoto,PSL,SP,governo,Dep. Guiga Peixoto (PSL/SP),1
40,204524,Dep. Pinheirinho,PP,MG,governo,Dep. Pinheirinho (PP/MG),1
40,204530,Dep. Rodrigo Agostinho,PSB,SP,oposição,Dep. Rodrigo Agostinho (PSB/SP),2
40,204536,Dep. Kim Kataguiri,DEM,SP,governo,Dep. Kim Kataguiri (DEM/SP),1
40,204541,Dep. Eduardo Bismarck,PDT,CE,oposição,Dep. Eduardo Bismarck (PDT/CE),5
40,204543,Dep. Luiz Flávio Gomes,PSB,SP,oposição,Dep. Luiz Flávio Gomes (PSB/SP),1
40,205865,Dep. Reinhold Stephanes Junior,PSD,PR,governo,Dep. Reinhold Stephanes Junior (PSD/PR),3
40,4930,Dep. Silvio Costa,AVANTE,PE,governo,Dep. Silvio Costa (AVANTE/PE),1
40,73466,Dep. Rubens Bueno,CIDADANIA,PR,governo,Dep. Rubens Bueno (CIDADANIA/PR),2
40,73492,Dep. Antonio Carlos Biscaia,PT,RJ,oposição,Dep. Antonio Carlos Biscaia (PT/RJ),1
40,73584,Dep. Antonio Carlos Mendes Thame,PV,SP,governo,Dep. Antonio Carlos Mendes Thame (PV/SP),1
40,74043,Dep. Wellington Roberto,PL,PB,governo,Dep. Wellington Roberto (PL/PB),17
40,74060,Dep. Daniel Almeida,PCdoB,BA,oposição,Dep. Daniel Almeida (PCdoB/BA),4
40,74158,Dep. Mário Heringer,PDT,MG,oposição,Dep. Mário Heringer (PDT/MG),4
40,74171,Dep. Chico Alencar,PSOL,RJ,oposição,Dep. Chico Alencar (PSOL/RJ),1
40,74262,Dep. Carlos Sampaio,PSDB,SP,governo,Dep. Carlos Sampaio (PSDB/SP),0.8
40,74283,Dep. Vicentinho,PT,SP,oposição,Dep. Vicentinho (PT/SP),2
40,74366,Dep. João Campos,PRB,GO,governo,Dep. João Campos (PRB/GO),2
40,74674,Dep. Ricardo Ferraço,PPS,ES,governo,Dep. Ricardo Ferraço (PPS/ES),1
40,74777,Dep. Rita Camata,PSDB,ES,governo,Dep. Rita Camata (PSDB/ES),1
40,81055,Dep. Márcio Jerry,PCdoB,MA,oposição,Dep. Márcio Jerry (PCdoB/MA),3
40,92699,Dep. Fernando Monteiro,PP,PE,governo,Dep. Fernando Monteiro (PP/PE),1
40,5929,Sen. Juíza Selma,PSL,MT,governo,Sen. Juíza Selma (PSL/MT),1
40,5953,Sen. Fabiano Contarato,REDE,ES,oposição,Sen. Fabiano Contarato (REDE/ES),1
40,5982,Sen. Alessandro Vieira,CIDADANIA,SE,governo,Sen. Alessandro Vieira (CIDADANIA/SE),1
40,204358,Dep. Beto Pereira,PSDB,MS,governo,Dep. Beto Pereira (PSDB/MS),0.8
41,108338,Dep. Jaqueline Cassol,PP,RO,governo,Dep. Jaqueline Cassol (PP/RO),1
41,133439,Dep. André Figueiredo,PDT,CE,oposição,Dep. André Figueiredo (PDT/CE),38
41,141391,Dep. Arnaldo Jardim,CIDADANIA,SP,governo,Dep. Arnaldo Jardim (CIDADANIA/SP),1
41,141411,Dep. Dagoberto Nogueira,PDT,MS,oposição,Dep. Dagoberto Nogueira (PDT/MS),1
41,141488,Dep. Paulo Teixeira,PT,SP,oposição,Dep. Paulo Teixeira (PT/SP),3
41,160511,Dep. Alessandro Molon,PSB,RJ,oposição,Dep. Alessandro Molon (PSB/RJ),9
41,160568,Dep. Rogério Carvalho,PT,SE,oposição,Dep. Rogério Carvalho (PT/SE),8
41,160570,Dep. Jerônimo Goergen,PP,RS,governo,Dep. Jerônimo Goergen (PP/RS),7
41,160632,Dep. Zé Silva,SOLIDARIEDADE,MG,governo,Dep. Zé Silva (SOLIDARIEDADE/MG),3
41,172711,Dep. Plínio Valério,PSDB,AM,governo,Dep. Plínio Valério (PSDB/AM),1
41,178836,Dep. Alan Rick,DEM,AC,governo,Dep. Alan Rick (DEM/AC),5
41,178871,Dep. Evair Vieira De Melo,PP,ES,governo,Dep. Evair Vieira De Melo (PP/ES),2
41,178874,Dep. Sergio Vidigal,PDT,ES,oposição,Dep. Sergio Vidigal (PDT/ES),1
41,178897,Dep. Rodrigo Pacheco,DEM,MG,governo,Dep. Rodrigo Pacheco (DEM/MG),10
41,178909,Dep. Hélio Leite,DEM,PA,governo,Dep. Hélio Leite (DEM/PA),1
41,178949,Dep. Zenaide Maia,PHS,RN,governo,Dep. Zenaide Maia (PHS/RN),3
41,178961,Dep. Shéridan,PSDB,RR,governo,Dep. Shéridan (PSDB/RR),2
41,178970,Dep. João Daniel,PT,SE,oposição,Dep. João Daniel (PT/SE),2
41,178977,Dep. Eduardo Cury,PSDB,SP,governo,Dep. Eduardo Cury (PSDB/SP),35
41,204371,Dep. Felipe Rigoni,PSB,ES,oposição,Dep. Felipe Rigoni (PSB/ES),13
41,204380,Dep. Celina Leão,PP,DF,governo,Dep. Celina Leão (PP/DF),2
41,204386,Dep. Jose Mario Schreiner,DEM,GO,governo,Dep. Jose Mario Schreiner (DEM/GO),2
41,204389,Dep. Elias Vaz,PSB,GO,oposição,Dep. Elias Vaz (PSB/GO),4
41,204395,Dep. Pedro Lupion,DEM,PR,governo,Dep. Pedro Lupion (DEM/PR),9
41,204410,Dep. Luisa Canziani,PTB,PR,governo,Dep. Luisa Canziani (PTB/PR),1
41,204425,Dep. Silvio Costa Filho,PRB,PE,governo,Dep. Silvio Costa Filho (PRB/PE),1
41,204429,Dep. João H. Campos,PSB,PE,oposição,Dep. João H. Campos (PSB/PE),9
41,204472,Dep. José Medeiros,PODE,MT,governo,Dep. José Medeiros (PODE/MT),1
41,204477,Dep. Felício Laterça,PSL,RJ,governo,Dep. Felício Laterça (PSL/RJ),9
41,204485,Dep. Luiz Carlos Motta,PL,SP,governo,Dep. Luiz Carlos Motta (PL/SP),2
41,204500,Dep. Eduardo Costa,PTB,PA,governo,Dep. Eduardo Costa (PTB/PA),1
41,204504,Dep. Cezinha De Madureira,PSD,SP,governo,Dep. Cezinha De Madureira (PSD/SP),1
41,204516,Dep. Alexis Fonteyne,NOVO,SP,governo,Dep. Alexis Fonteyne (NOVO/SP),16
41,204532,Dep. Vinicius Poit,NOVO,SP,governo,Dep. Vinicius Poit (NOVO/SP),11
41,204536,Dep. Kim Kataguiri,DEM,SP,governo,Dep. Kim Kataguiri (DEM/SP),2
41,204548,Dep. Heitor Freire,PSL,CE,governo,Dep. Heitor Freire (PSL/CE),3
41,204556,Dep. Marcelo Ramos,PL,AM,governo,Dep. Marcelo Ramos (PL/AM),1
41,4931,Dep. Izalci Lucas,PSDB,DF,governo,Dep. Izalci Lucas (PSDB/DF),2
41,68720,Dep. Fábio Henrique,PDT,SE,oposição,Dep. Fábio Henrique (PDT/SE),5
41,69871,Dep. Bacelar,PODE,BA,governo,Dep. Bacelar (PODE/BA),1
41,73486,Dep. Pompeo De Mattos,PDT,RS,oposição,Dep. Pompeo De Mattos (PDT/RS),3
41,73531,Dep. Ivan Valente,PSOL,SP,oposição,Dep. Ivan Valente (PSOL/SP),4
41,73592,Dep. Kátia Abreu,PFL,TO,governo,Dep. Kátia Abreu (PFL/TO),1
41,73801,Dep. Renildo Calheiros,PCdoB,PE,oposição,Dep. Renildo Calheiros (PCdoB/PE),4
41,73924,Dep. Davi Alcolumbre,DEM,AP,governo,Dep. Davi Alcolumbre (DEM/AP),1
41,73933,Dep. Zequinha Marinho,PSC,,governo,Dep. Zequinha Marinho (PSC/NA),2
41,73943,Dep. Perpétua Almeida,PCdoB,AC,oposição,Dep. Perpétua Almeida (PCdoB/AC),1
41,73945,Dep. Eduardo Gomes,SD,TO,governo,Dep. Eduardo Gomes (SD/TO),2
41,74057,Dep. Alice Portugal,PCdoB,BA,oposição,Dep. Alice Portugal (PCdoB/BA),5
41,74060,Dep. Daniel Almeida,PCdoB,BA,oposição,Dep. Daniel Almeida (PCdoB/BA),5
41,74398,Dep. Maria Do Rosário,PT,RS,oposição,Dep. Maria Do Rosário (PT/RS),6
41,74400,Dep. Paulo Pimenta,PT,RS,oposição,Dep. Paulo Pimenta (PT/RS),37
41,74419,Dep. Gonzaga Patriota,PSB,PE,oposição,Dep. Gonzaga Patriota (PSB/PE),1
41,74478,Dep. Luciano Bivar,PSL,PE,governo,Dep. Luciano Bivar (PSL/PE),2
41,74548,Dep. Jaques Wagner,PT,BA,oposição,Dep. Jaques Wagner (PT/BA),12
41,74585,Dep. Lincoln Portela,PL,MG,governo,Dep. Lincoln Portela (PL/MG),3
41,74848,Dep. Jandira Feghali,PCdoB,RJ,oposição,Dep. Jandira Feghali (PCdoB/RJ),5
41,81055,Dep. Márcio Jerry,PCdoB,MA,oposição,Dep. Márcio Jerry (PCdoB/MA),4
41,1249,Sen. Kátia Abreu,PMDB,TO,governo,Sen. Kátia Abreu (PMDB/TO),1
41,141470,Sen. José Guimarães,PT,CE,oposição,Sen. José Guimarães (PT/CE),5
41,141513,Sen. Bilac Pinto,DEM,MG,governo,Sen. Bilac Pinto (DEM/MG),1
41,171619,Sen. Margarida Salomão,PT,MG,oposição,Sen. Margarida Salomão (PT/MG),1
41,204576,Sen. João Roma,PRB,BA,governo,Sen. João Roma (PRB/BA),1
41,3396,Sen. Tasso Jereissati,PSDB,CE,governo,Sen. Tasso Jereissati (PSDB/CE),3
41,3777,Sen. Eduardo Gomes,MDB,TO,governo,Sen. Eduardo Gomes (MDB/TO),2
41,3806,Sen. Zequinha Marinho,PSC,PA,governo,Sen. Zequinha Marinho (PSC/PA),2
41,3830,Sen. Davi Alcolumbre,DEM,AP,governo,Sen. Davi Alcolumbre (DEM/AP),1
41,4531,Sen. Jayme Campos,DEM,MT,governo,Sen. Jayme Campos (DEM/MT),2
41,4770,Sen. Izalci Lucas,PSDB,DF,governo,Sen. Izalci Lucas (PSDB/DF),4
41,4981,Sen. Acir Gurgacz,PDT,RO,oposição,Sen. Acir Gurgacz (PDT/RO),5
41,5008,Sen. Humberto Costa,PT,PE,oposição,Sen. Humberto Costa (PT/PE),5
41,5012,Sen. Randolfe Rodrigues,REDE,AP,oposição,Sen. Randolfe Rodrigues (REDE/AP),3
41,5352,Sen. Rogério Carvalho,PT,SE,oposição,Sen. Rogério Carvalho (PT/SE),10
41,5411,Sen. Weverton,PDT,MA,oposição,Sen. Weverton (PDT/MA),3
41,5502,Sen. Plínio Valério,PSDB,AM,governo,Sen. Plínio Valério (PSDB/AM),1
41,5523,Sen. Otto Alencar,PSD,BA,governo,Sen. Otto Alencar (PSD/BA),2
41,5529,Sen. Antonio Anastasia,PSDB,MG,governo,Sen. Antonio Anastasia (PSDB/MG),3
41,5537,Sen. Dário Berger,MDB,SC,governo,Sen. Dário Berger (MDB/SC),12
41,5627,Sen. Jean Paul Prates,PT,RN,oposição,Sen. Jean Paul Prates (PT/RN),9
41,5718,Sen. Eliziane Gama,CIDADANIA,MA,governo,Sen. Eliziane Gama (CIDADANIA/MA),3
41,5732,Sen. Rodrigo Pacheco,DEM,MG,governo,Sen. Rodrigo Pacheco (DEM/MG),10
41,5783,Sen. Zenaide Maia,PROS,RN,governo,Sen. Zenaide Maia (PROS/RN),7
41,581,Sen. Jaques Wagner,PT,BA,oposição,Sen. Jaques Wagner (PT/BA),12
41,5905,Sen. Rodrigo Cunha,PSDB,AL,governo,Sen. Rodrigo Cunha (PSDB/AL),2
41,5953,Sen. Fabiano Contarato,REDE,ES,oposição,Sen. Fabiano Contarato (REDE/ES),2
41,5979,Sen. Leila Barros,PSB,DF,oposição,Sen. Leila Barros (PSB/DF),3
41,5988,Sen. Soraya Thronicke,PSL,MS,governo,Sen. Soraya Thronicke (PSL/MS),3
41,5998,Sen. Daniella Ribeiro,PP,PB,governo,Sen. Daniella Ribeiro (PP/PB),2
41,90,Sen. José Serra,PSDB,SP,governo,Sen. José Serra (PSDB/SP),1
42,108338,Dep. Jaqueline Cassol,PP,RO,governo,Dep. Jaqueline Cassol (PP/RO),1
42,118594,Dep. Marcelo Squassoni,PRB,SP,governo,Dep. Marcelo Squassoni (PRB/SP),0.8333333333333333
42,141408,Dep. Cleber Verde,PRB,MA,governo,Dep. Cleber Verde (PRB/MA),1
42,141417,Dep. Edio Lopes,PL,RR,governo,Dep. Edio Lopes (PL/RR),2
42,141421,Dep. Eduardo Da Fonte,PP,PE,governo,Dep. Eduardo Da Fonte (PP/PE),1
42,141531,Dep. Rodrigo De Castro,PSDB,MG,governo,Dep. Rodrigo De Castro (PSDB/MG),0.8333333333333333
42,160528,Dep. Danilo Cabral,PSB,PE,oposição,Dep. Danilo Cabral (PSB/PE),1
42,160538,Dep. Bohn Gass,PT,RS,oposição,Dep. Bohn Gass (PT/RS),20
42,160575,Dep. Erika Kokay,PT,DF,oposição,Dep. Erika Kokay (PT/DF),8.666666666666666
42,160758,Dep. Domingos Sávio,PSDB,MG,governo,Dep. Domingos Sávio (PSDB/MG),2
42,178844,Dep. Pedro Vilela,PSDB,AL,governo,Dep. Pedro Vilela (PSDB/AL),0.8333333333333333
42,178905,Dep. Fabio Garcia,DEM,MT,governo,Dep. Fabio Garcia (DEM/MT),1
42,204505,Dep. Vavá Martins,PRB,PA,governo,Dep. Vavá Martins (PRB/PA),1
42,204523,Dep. Lucas Gonzalez,NOVO,MG,governo,Dep. Lucas Gonzalez (NOVO/MG),1
42,73433,Dep. Arlindo Chinaglia,PT,SP,oposição,Dep. Arlindo Chinaglia (PT/SP),8.666666666666666
42,73584,Dep. Antonio Carlos Mendes Thame,PV,SP,governo,Dep. Antonio Carlos Mendes Thame (PV/SP),0.8333333333333333
42,73655,Dep. Augusto Carvalho,SOLIDARIEDADE,DF,governo,Dep. Augusto Carvalho (SOLIDARIEDADE/DF),0.8333333333333333
42,98057,Dep. Lafayette De Andrada,PRB,MG,governo,Dep. Lafayette De Andrada (PRB/MG),1
